DICA,WASHINGTON REIS,abstencoes,aptos,bairro,cep,codigo_municipio,endereco,location,nao_considerados,nome_local,nome_munic,num_local,percentual_abstencoes,percentual_anulados,percentual_brancos,percentual_legenda,percentual_nominais,percentual_nulos,secao,votos_anulados,votos_brancos,votos_legenda,votos_nominais,votos_nulos,zona
111,124,107,397,JARDIM PRIMAVERA,25215250,58335,AV. JORNALISTA MOACYR PADILHA S/N,"AV. JORNALISTA MOACYR PADILHA S/N, JARDIM PRIMAVERA, DUQUE DE CAXIAS, Rio de Janeiro",162,ESCOLA ESTADUAL MINAS GERAIS,DUQUE DE CAXIAS,1139,0.27,0.0,0.03,0.0,0.59,0.11,88,0,13,0,235,42,126
99,93,68,310,GRAMACHO,25035250,58335,AV. DARCY VARGAS 21,"AV. DARCY VARGAS 21, GRAMACHO, DUQUE DE CAXIAS, Rio de Janeiro",118,ESCOLA MUNICIPAL CORA CORALINA (ANTIGA THIAGO APOSTOLO),DUQUE DE CAXIAS,1120,0.22,0.0,0.04,0.0,0.62,0.13,73,0,11,0,192,39,194
104,157,98,394,IMBARIÊ,25000000,58335,"RUA GOINDIRA, 379","RUA GOINDIRA, 379, IMBARIÊ, DUQUE DE CAXIAS, Rio de Janeiro",133,COLÉGIO ESTADUAL FERNANDO FIGUEIREDO,DUQUE DE CAXIAS,1031,0.25,0.0,0.03,0.0,0.66,0.06,11,0,11,0,261,24,127
166,106,113,442,JARDIM 25 DE AGOSTO,25071202,58335,"RUA PROF. JOSÉ DE SOUZA HERDY, 1160","RUA PROF. JOSÉ DE SOUZA HERDY, 1160, JARDIM 25 DE AGOSTO, DUQUE DE CAXIAS, Rio de Janeiro",170,UNIGRANRIO,DUQUE DE CAXIAS,1015,0.26,0.0,0.03,0.0,0.62,0.1,199,0,14,0,272,43,66
68,200,62,375,VILA BONANÇA,25000000,58335,RUA JOAO SANTOS SOBRINHO 16,"RUA JOAO SANTOS SOBRINHO 16, VILA BONANÇA, DUQUE DE CAXIAS, Rio de Janeiro",107,ESCOLA MUNICIPAL BRASILIA,DUQUE DE CAXIAS,1163,0.17,0.0,0.03,0.0,0.71,0.09,145,0,11,0,268,34,128
160,85,89,371,JARDIM 25 DE AGOSTO,25075015,58335,"RUA MAJOR CORRÊA DE MELO, 86","RUA MAJOR CORRÊA DE MELO, 86, JARDIM 25 DE AGOSTO, DUQUE DE CAXIAS, Rio de Janeiro",126,ESTÁCIO,DUQUE DE CAXIAS,1090,0.24,0.0,0.03,0.0,0.66,0.07,162,0,10,0,245,27,66
96,157,93,382,CIDADE DOS MENINOS,25233000,58335,AV. PRESIDENTE KENNEDY KM 12,"AV. PRESIDENTE KENNEDY KM 12, CIDADE DOS MENINOS, DUQUE DE CAXIAS, Rio de Janeiro",129,ESCOLA ESTADUAL ASSIS CHATEAUBRIAND,DUQUE DE CAXIAS,1074,0.24,0.0,0.01,0.0,0.66,0.08,35,0,4,0,253,32,79
73,176,109,397,SANTA CRUZ DA SERRA,25255070,58335,RUA ALAGOAS S/N,"RUA ALAGOAS S/N, SANTA CRUZ DA SERRA, DUQUE DE CAXIAS, Rio de Janeiro",148,ESCOLA MUNICIPAL ROTARY,DUQUE DE CAXIAS,1040,0.27,0.0,0.03,0.0,0.63,0.07,14,0,12,0,249,27,128
111,123,76,362,SANTA LÚCIA,25271080,58335,"RUA URUBÁ, 30","RUA URUBÁ, 30, SANTA LÚCIA, DUQUE DE CAXIAS, Rio de Janeiro",128,ESCOLA ESTADUAL OPERÁRIO JOÃO VICENTE,DUQUE DE CAXIAS,1368,0.21,0.0,0.05,0.0,0.65,0.1,239,0,17,0,234,35,127
105,142,111,393,JARDIM GRAMACHO,25056070,58335,RUA FREI CANECA 98,"RUA FREI CANECA 98, JARDIM GRAMACHO, DUQUE DE CAXIAS, Rio de Janeiro",146,COLÉGIO ESTADUAL ÁLVARO NEGROMONTE,DUQUE DE CAXIAS,1139,0.28,0.0,0.04,0.0,0.63,0.05,56,0,14,0,247,21,78
107,144,96,396,CAMPOS ELÍSEOS,25225636,58335,RUA DO ROSARIO 119,"RUA DO ROSARIO 119, CAMPOS ELÍSEOS, DUQUE DE CAXIAS, Rio de Janeiro",145,INSTITUTO CULTURAL FLAVIO CASIMIRO,DUQUE DE CAXIAS,1660,0.24,0.0,0.03,0.0,0.63,0.09,22,0,13,0,251,36,126
134,127,69,393,JARDIM OLAVO BILAC,25036460,58335,"PRAÇA OTÁVIO CARNEIRO, LOTE 14, QUADRA 12","PRAÇA OTÁVIO CARNEIRO, LOTE 14, QUADRA 12, JARDIM OLAVO BILAC, DUQUE DE CAXIAS, Rio de Janeiro",132,ASSOCIAÇÃO EDUCACIONAL COLÉGIO OLAVO BILAC,DUQUE DE CAXIAS,1155,0.18,0.0,0.04,0.0,0.66,0.12,117,0,17,0,261,46,194
115,43,42,216,PRAINHA,25015655,58335,"RUA ROCHA PITA, S/N","RUA ROCHA PITA, S/N, PRAINHA, DUQUE DE CAXIAS, Rio de Janeiro",58,ESCOLA MUNICIPAL PRAINHA (PROFº. JAIR ALVES DE FREITAS),DUQUE DE CAXIAS,1511,0.19,0.0,0.02,0.0,0.73,0.05,272,0,5,0,158,11,103
137,100,80,363,SÃO BENTO,25045030,58335,AVENIDA PRESIDENTE KENNEDY S/N,"AVENIDA PRESIDENTE KENNEDY S/N, SÃO BENTO, DUQUE DE CAXIAS, Rio de Janeiro",126,ESCOLA MUNICIPAL NISIA VILELA FERNANDES,DUQUE DE CAXIAS,2208,0.22,0.0,0.03,0.0,0.65,0.1,565,0,10,0,237,36,79
134,97,70,338,SÃO BENTO,25045000,58335,AV. PRESIDENTE KENNEDY S/N,"AV. PRESIDENTE KENNEDY S/N, SÃO BENTO, DUQUE DE CAXIAS, Rio de Janeiro",107,CIEP 201 AARAO STEINBRUCH,DUQUE DE CAXIAS,1910,0.21,0.0,0.02,0.0,0.68,0.09,381,0,8,0,231,29,79
113,69,87,301,25 DE AGOSTO,25071181,58335,"AV. BRIGADEIRO LIMA E SILVA, 764","AV. BRIGADEIRO LIMA E SILVA, 764, 25 DE AGOSTO, DUQUE DE CAXIAS, Rio de Janeiro",119,SENAC,DUQUE DE CAXIAS,1120,0.29,0.0,0.03,0.0,0.6,0.08,85,0,8,0,182,24,200
22,69,18,124,VILA EMA,25268000,58335,"RUA M, SN","RUA M, SN, VILA EMA, DUQUE DE CAXIAS, Rio de Janeiro",33,ESCOLA ESTADUAL FRANCISCO PORTUGAL NEVES,DUQUE DE CAXIAS,1040,0.15,0.0,0.04,0.0,0.73,0.08,256,0,5,0,91,10,127
64,200,65,399,SANTA CRUZ DA SERRA,25255070,58335,RUA ALAGOAS S/N,"RUA ALAGOAS S/N, SANTA CRUZ DA SERRA, DUQUE DE CAXIAS, Rio de Janeiro",135,ESCOLA MUNICIPAL ROTARY,DUQUE DE CAXIAS,1040,0.16,0.0,0.04,0.0,0.66,0.14,124,0,15,0,264,55,128
76,182,103,390,PARQUE DAS MISSÕES,25085009,58335,ROD. WASHINGTON LUIZ KM 0,"ROD. WASHINGTON LUIZ KM 0, PARQUE DAS MISSÕES, DUQUE DE CAXIAS, Rio de Janeiro",132,CIEP 350 TÚLIO ROBERTO CARDOSO QUINTINIANO,DUQUE DE CAXIAS,1163,0.26,0.0,0.03,0.0,0.66,0.04,115,0,12,0,258,17,200
109,100,82,333,CENTRO,25010230,58335,"RUA JORGE VIEIRA DE MEDEIROS,101 - ANTIGA RUA 25 DE AGOSTO","RUA JORGE VIEIRA DE MEDEIROS,101 - ANTIGA RUA 25 DE AGOSTO, CENTRO, DUQUE DE CAXIAS, Rio de Janeiro",124,COLEGIO SÃO FRANCISCO,DUQUE DE CAXIAS,1112,0.25,0.0,0.02,0.0,0.63,0.11,59,0,7,0,209,35,103
134,107,85,399,JARDIM PRIMAVERA,25212310,58335,RUA LEIBRITZ S/N,"RUA LEIBRITZ S/N, JARDIM PRIMAVERA, DUQUE DE CAXIAS, Rio de Janeiro",158,CIEP 035 MARECHAL HENRIQUE TEIXEIRA LOTT,DUQUE DE CAXIAS,1082,0.21,0.0,0.03,0.0,0.6,0.15,55,0,12,0,241,61,126
90,182,89,392,PARQUE DAS MISSÕES,25085009,58335,ROD. WASHINGTON LUIZ KM 0,"ROD. WASHINGTON LUIZ KM 0, PARQUE DAS MISSÕES, DUQUE DE CAXIAS, Rio de Janeiro",120,CIEP 350 TÚLIO ROBERTO CARDOSO QUINTINIANO,DUQUE DE CAXIAS,1163,0.23,0.0,0.02,0.0,0.69,0.06,103,0,9,0,272,22,200
114,126,117,395,COPACABANA,25060200,58335,RUA PRESIDENTE JUSCELINO KUBISTCHEK DE OLIVEIRA 3374,"RUA PRESIDENTE JUSCELINO KUBISTCHEK DE OLIVEIRA 3374, COPACABANA, DUQUE DE CAXIAS, Rio de Janeiro",155,ESCOLA MUNICIPAL GENERAL SAMPAIO,DUQUE DE CAXIAS,1015,0.3,0.0,0.02,0.0,0.61,0.07,2,0,9,0,240,29,78
140,121,74,400,JARDIM PRIMAVERA,25212310,58335,RUA LEIBRITZ S/N,"RUA LEIBRITZ S/N, JARDIM PRIMAVERA, DUQUE DE CAXIAS, Rio de Janeiro",139,CIEP 035 MARECHAL HENRIQUE TEIXEIRA LOTT,DUQUE DE CAXIAS,1082,0.18,0.0,0.04,0.0,0.65,0.13,54,0,14,0,261,51,126
113,159,70,394,COPACABANA,25060200,58335,RUA PRESIDENTE JUSCELINO KUBISTCHEK DE OLIVEIRA 3374,"RUA PRESIDENTE JUSCELINO KUBISTCHEK DE OLIVEIRA 3374, COPACABANA, DUQUE DE CAXIAS, Rio de Janeiro",122,ESCOLA MUNICIPAL GENERAL SAMPAIO,DUQUE DE CAXIAS,1015,0.18,0.0,0.03,0.0,0.69,0.1,145,0,11,0,272,41,78
95,61,83,257,JARDIM GUANABARA,25086030,58335,ESTRADA SAO VICENTE 851,"ESTRADA SAO VICENTE 851, JARDIM GUANABARA, DUQUE DE CAXIAS, Rio de Janeiro",101,ESCOLA ESTADUAL MIGUEL COUTO,DUQUE DE CAXIAS,1040,0.32,0.0,0.01,0.0,0.61,0.06,26,0,3,0,156,15,200
120,135,62,389,SARACURUNA,25212440,58335,AV. URUGUAIANA S/N,"AV. URUGUAIANA S/N, SARACURUNA, DUQUE DE CAXIAS, Rio de Janeiro",134,ESCOLA MUNICIPAL JAYME FICHMAN,DUQUE DE CAXIAS,1449,0.16,0.0,0.04,0.0,0.66,0.15,219,0,15,0,255,57,126
50,187,99,379,CAPIVARI,25243574,58335,RUA MANZANARES S/N,"RUA MANZANARES S/N, CAPIVARI, DUQUE DE CAXIAS, Rio de Janeiro",142,ESCOLA ESTADUAL ABDALA CHAMA,DUQUE DE CAXIAS,1490,0.26,0.0,0.03,0.0,0.63,0.09,242,0,10,0,237,33,126
126,82,93,342,PARQUE LAFAIETE,25010540,58335,RUA MARIA LUIZA REIS S/N,"RUA MARIA LUIZA REIS S/N, PARQUE LAFAIETE, DUQUE DE CAXIAS, Rio de Janeiro",134,ESCOLA ESTADUAL DUQUE DE CAXIAS,DUQUE DE CAXIAS,1422,0.27,0.0,0.02,0.0,0.61,0.1,232,0,8,0,208,33,103
132,105,79,382,PARQUE MUISA,25044050,58335,RUA D  1,"RUA D  1, PARQUE MUISA, DUQUE DE CAXIAS, Rio de Janeiro",145,ESCOLA ESTADUAL SANTO INACIO,DUQUE DE CAXIAS,1732,0.21,0.0,0.04,0.0,0.62,0.13,543,0,16,0,237,50,79
107,139,109,399,CENTENÁRIO,25030040,58335,RUA OTÁVIO ASCOLI S/N,"RUA OTÁVIO ASCOLI S/N, CENTENÁRIO, DUQUE DE CAXIAS, Rio de Janeiro",153,ESCOLA ESTADUAL IRINEU MARINHO,DUQUE DE CAXIAS,1058,0.27,0.0,0.03,0.0,0.62,0.09,21,0,10,0,246,34,77
84,167,94,397,IMBARIÊ,25000000,58335,"RUA GOINDIRA, 379","RUA GOINDIRA, 379, IMBARIÊ, DUQUE DE CAXIAS, Rio de Janeiro",146,COLÉGIO ESTADUAL FERNANDO FIGUEIREDO,DUQUE DE CAXIAS,1031,0.24,0.0,0.05,0.0,0.63,0.08,220,0,19,0,251,33,127
96,87,50,274,PERIQUITOS,25010000,58335,"AV. HENRIQUE VALADARES, 16","AV. HENRIQUE VALADARES, 16, PERIQUITOS, DUQUE DE CAXIAS, Rio de Janeiro",91,ESCOLA MUNICIPAL PROFESSORA MARIA JOSÉ DE OLIVEIRA,DUQUE DE CAXIAS,1260,0.18,0.0,0.04,0.0,0.67,0.11,133,0,11,0,183,30,77
125,54,47,244,ENGENHO DO PORTO,25015190,58335,RUA COMANDANTE ARI PARREIRAS S/N,"RUA COMANDANTE ARI PARREIRAS S/N, ENGENHO DO PORTO, DUQUE DE CAXIAS, Rio de Janeiro",65,CIEP ANTONIETA CAMPOS DA PAZ (CIEP 434-MARIA JOSE MACHADO),DUQUE DE CAXIAS,1368,0.19,0.0,0.01,0.0,0.73,0.06,243,0,3,0,179,15,103
40,229,74,376,CAPIVARI,25243150,58335,PRACA SAO LOURENCO 112,"PRACA SAO LOURENCO 112, CAPIVARI, DUQUE DE CAXIAS, Rio de Janeiro",107,ESCOLA MUNICIPAL PRESIDENTE COSTA E SILVA,DUQUE DE CAXIAS,1406,0.2,0.0,0.02,0.0,0.72,0.06,328,0,9,0,269,24,126
102,164,73,396,VILA CANAAN,25255160,58335,RUA BONSUCESSO S/N,"RUA BONSUCESSO S/N, VILA CANAAN, DUQUE DE CAXIAS, Rio de Janeiro",130,ESCOLA ESTADUAL ALEMY TAVARES DA SILVA,DUQUE DE CAXIAS,1139,0.18,0.0,0.04,0.0,0.67,0.11,84,0,14,0,266,43,128
122,80,135,367,CENTRO,25010000,58335,AV. PRESIDENTE KENNEDY 514,"AV. PRESIDENTE KENNEDY 514, CENTRO, DUQUE DE CAXIAS, Rio de Janeiro",165,COLEGIO FUTURO VIP (ANTIGO CURSO GPI),DUQUE DE CAXIAS,1058,0.37,0.0,0.03,0.0,0.55,0.05,20,0,10,0,202,20,103
132,133,66,396,DOUTOR LAUREANO,25050580,58335,AV. CHOPIN 25,"AV. CHOPIN 25, DOUTOR LAUREANO, DUQUE DE CAXIAS, Rio de Janeiro",131,ESCOLA ESTADUAL HERBERT MOSES,DUQUE DE CAXIAS,1082,0.17,0.0,0.03,0.0,0.67,0.13,110,0,12,0,265,53,78
127,103,113,396,JARDIM 25 DE AGOSTO,25071202,58335,"RUA PROF. JOSÉ DE SOUZA HERDY, 1160","RUA PROF. JOSÉ DE SOUZA HERDY, 1160, JARDIM 25 DE AGOSTO, DUQUE DE CAXIAS, Rio de Janeiro",166,UNIGRANRIO,DUQUE DE CAXIAS,1015,0.29,0.0,0.03,0.0,0.58,0.11,141,0,10,0,230,43,66
99,133,84,386,SARACURUNA,25220660,58335,RUA DO PORTO S/N,"RUA DO PORTO S/N, SARACURUNA, DUQUE DE CAXIAS, Rio de Janeiro",154,CIEP 228 DARCY VARGAS,DUQUE DE CAXIAS,1554,0.22,0.0,0.03,0.0,0.6,0.15,298,0,13,0,232,57,126
68,110,70,291,NOVA CAMPINAS,25211220,58335,"AV. A, S/N","AV. A, S/N, NOVA CAMPINAS, DUQUE DE CAXIAS, Rio de Janeiro",113,CIEP 227 - PROCÓPIO FERREIRA,DUQUE DE CAXIAS,1120,0.24,0.0,0.03,0.0,0.61,0.11,113,0,10,0,178,33,127
74,94,94,299,PARADA ANGÉLICA,25272230,58335,"RUA REAL DA ESTRELA, S/N","RUA REAL DA ESTRELA, S/N, PARADA ANGÉLICA, DUQUE DE CAXIAS, Rio de Janeiro",131,CIEP 407 - NEUZA GOULART BRIZOLA,DUQUE DE CAXIAS,1074,0.31,0.0,0.04,0.0,0.56,0.08,43,0,12,0,168,25,127
96,137,86,360,SÃO BENTO,25045030,58335,AVENIDA PRESIDENTE KENNEDY S/N,"AVENIDA PRESIDENTE KENNEDY S/N, SÃO BENTO, DUQUE DE CAXIAS, Rio de Janeiro",127,ESCOLA MUNICIPAL NISIA VILELA FERNANDES,DUQUE DE CAXIAS,2208,0.24,0.0,0.02,0.0,0.65,0.09,583,0,9,0,233,32,79
99,77,122,331,CENTRO,25070005,58335,"PRACA ROBERTO SILVEIRA, 24","PRACA ROBERTO SILVEIRA, 24, CENTRO, DUQUE DE CAXIAS, Rio de Janeiro",155,CEF - CAIXA ECONÔMICA FEDERAL - AGÊNCIA 1334 - 25 DE AGOSTO,DUQUE DE CAXIAS,1112,0.37,0.0,0.02,0.0,0.53,0.08,47,0,7,0,176,26,66
135,111,89,400,JARDIM PRIMAVERA,25223540,58335,PRACA NOSSA SENHORA DE LOURDES S/N,"PRACA NOSSA SENHORA DE LOURDES S/N, JARDIM PRIMAVERA, DUQUE DE CAXIAS, Rio de Janeiro",154,CIEP 209 ATAULPHO ALVES,DUQUE DE CAXIAS,1120,0.22,0.0,0.04,0.0,0.62,0.12,83,0,17,0,246,48,126
62,200,75,378,CAPIVARI,25243574,58335,RUA MANZANARES S/N,"RUA MANZANARES S/N, CAPIVARI, DUQUE DE CAXIAS, Rio de Janeiro",116,ESCOLA ESTADUAL ABDALA CHAMA,DUQUE DE CAXIAS,1490,0.2,0.0,0.04,0.0,0.69,0.07,243,0,16,0,262,25,126
119,93,107,343,JARDIM GUANABARA,25086030,58335,ESTRADA SAO VICENTE 851,"ESTRADA SAO VICENTE 851, JARDIM GUANABARA, DUQUE DE CAXIAS, Rio de Janeiro",131,ESCOLA ESTADUAL MIGUEL COUTO,DUQUE DE CAXIAS,1040,0.31,0.0,0.02,0.0,0.62,0.05,25,0,7,0,212,17,200
130,152,121,460,CIDADE DOS MENINOS,25233000,58335,AV.PRESIDENTE KENNEDY KM 12,"AV.PRESIDENTE KENNEDY KM 12, CIDADE DOS MENINOS, DUQUE DE CAXIAS, Rio de Janeiro",178,CIEP 032 - CORA CORALINA,DUQUE DE CAXIAS,1066,0.26,0.0,0.04,0.0,0.61,0.08,29,0,19,0,282,38,79
75,173,84,399,PARQUE PAULISTA,25261000,58335,"AV. 31 DE MARÇO, 88","AV. 31 DE MARÇO, 88, PARQUE PAULISTA, DUQUE DE CAXIAS, Rio de Janeiro",151,CIEP 015 - MUNICIPALIZADO HENRIQUE DE SOUZA FILHO - HENFIL,DUQUE DE CAXIAS,1279,0.21,0.0,0.07,0.0,0.62,0.1,160,0,26,0,248,41,127
124,106,113,371,COPACABANA,25060350,58335,RUA ITU 1,"RUA ITU 1, COPACABANA, DUQUE DE CAXIAS, Rio de Janeiro",141,ESCOLA ESTADUAL ARARIBÓIA,DUQUE DE CAXIAS,1031,0.3,0.0,0.02,0.0,0.62,0.05,13,0,8,0,230,20,78
71,65,50,211,CENTRO,25020150,58335,"RUA JOSE DE ALVARENGA, 642","RUA JOSE DE ALVARENGA, 642, CENTRO, DUQUE DE CAXIAS, Rio de Janeiro",75,IPMDC-INSTITUTO DE PREVIDENCIA MUNICIPAL DE DUQUE DE CAXIAS,DUQUE DE CAXIAS,1171,0.24,0.0,0.03,0.0,0.64,0.09,146,0,7,0,136,18,103
104,128,80,370,NOVA CAMPINAS,25265000,58335,"AV. A, S/N - QD 93","AV. A, S/N - QD 93, NOVA CAMPINAS, DUQUE DE CAXIAS, Rio de Janeiro",138,CRECHE E PRÉ-ESCOLA MUNICIPAL PROFESSORA ARMANDA ÁLVARO ALBERTO,DUQUE DE CAXIAS,1309,0.22,0.0,0.03,0.0,0.63,0.13,143,0,11,0,232,47,127
107,129,99,396,SARACURUNA,25212662,58335,RUA CASTRO ALVES S/N,"RUA CASTRO ALVES S/N, SARACURUNA, DUQUE DE CAXIAS, Rio de Janeiro",160,CIEP 229 CANDIDO PORTINARI,DUQUE DE CAXIAS,1724,0.25,0.0,0.04,0.0,0.6,0.11,233,0,17,0,236,44,126
47,223,91,375,XERÉM,25250310,58335,ESTRADA DA IGREJA VELHA-F.N.M. S/N,"ESTRADA DA IGREJA VELHA-F.N.M. S/N, XERÉM, DUQUE DE CAXIAS, Rio de Janeiro",105,ESCOLA ESTADUAL SANTO ANTONIO,DUQUE DE CAXIAS,1090,0.24,0.0,0.01,0.0,0.72,0.03,33,0,2,0,270,12,128
157,103,97,393,PARQUE LAGUNA E DOURADOS,25085420,58335,"AV. DR. MANOEL TELLES, S/N","AV. DR. MANOEL TELLES, S/N, PARQUE LAGUNA E DOURADOS, DUQUE DE CAXIAS, Rio de Janeiro",133,CENTRO EDUCACIONAL COLEGIO CARLOS GOMES (QUADRA),DUQUE DE CAXIAS,1325,0.25,0.0,0.01,0.0,0.66,0.08,132,0,5,0,260,31,103
113,119,78,364,SANTA LÚCIA,25271080,58335,"RUA URUBÁ, 30","RUA URUBÁ, 30, SANTA LÚCIA, DUQUE DE CAXIAS, Rio de Janeiro",132,ESCOLA ESTADUAL OPERÁRIO JOÃO VICENTE,DUQUE DE CAXIAS,1368,0.21,0.0,0.04,0.0,0.64,0.11,33,0,15,0,232,39,127
114,151,87,395,CENTENÁRIO,25030150,58335,RUA CEL. ALBERTO DE MELO S/N,"RUA CEL. ALBERTO DE MELO S/N, CENTENÁRIO, DUQUE DE CAXIAS, Rio de Janeiro",130,ESCOLA MUNICIPAL HELENA AGUIAR DE MEDEIROS,DUQUE DE CAXIAS,1082,0.22,0.0,0.05,0.0,0.67,0.06,127,0,18,0,265,25,77
52,193,105,380,CAPIVARI,25243150,58335,PRACA SAO LOURENCO 112,"PRACA SAO LOURENCO 112, CAPIVARI, DUQUE DE CAXIAS, Rio de Janeiro",135,ESCOLA MUNICIPAL PRESIDENTE COSTA E SILVA,DUQUE DE CAXIAS,1406,0.28,0.0,0.02,0.0,0.64,0.06,193,0,6,0,245,24,126
86,154,121,398,JARDIM GRAMACHO,25055340,58335,"RUA CARAMURU, 84","RUA CARAMURU, 84, JARDIM GRAMACHO, DUQUE DE CAXIAS, Rio de Janeiro",158,ESCOLA MUNICIPAL MAURO DE CASTRO,DUQUE DE CAXIAS,1350,0.3,0.0,0.02,0.0,0.6,0.08,66,0,7,0,240,30,78
85,64,100,272,JARDIM 25 DE AGOSTO,25071181,58335,"AV. BRIGADEIRO LIMA E SILVA, 2059 - AG.129","AV. BRIGADEIRO LIMA E SILVA, 2059 - AG.129, JARDIM 25 DE AGOSTO, DUQUE DE CAXIAS, Rio de Janeiro",123,BRADESCO - AGÊNCIA 0129,DUQUE DE CAXIAS,1317,0.37,0.0,0.01,0.0,0.55,0.07,7,0,4,0,149,19,66
85,40,81,237,PARQUE LAFAIETE,25010540,58335,RUA MARIA LUIZA REIS S/N,"RUA MARIA LUIZA REIS S/N, PARQUE LAFAIETE, DUQUE DE CAXIAS, Rio de Janeiro",112,ESCOLA MUNICIPAL OLGA TEIXEIRA DE OLIVEIRA,DUQUE DE CAXIAS,1414,0.34,0.0,0.03,0.0,0.53,0.1,222,0,8,0,125,23,103
145,71,97,346,PARQUE LAFAIETE,25025020,58335,AV. NILO PECANHA 2716,"AV. NILO PECANHA 2716, PARQUE LAFAIETE, DUQUE DE CAXIAS, Rio de Janeiro",130,ESCOLA VENANCIO PEREIRA VELLOSO,DUQUE DE CAXIAS,1473,0.28,0.0,0.03,0.0,0.62,0.07,198,0,9,0,216,24,103
115,123,72,348,VILA SÃO LUIS,25065050,58335,RUA GENERAL MANOEL RABELO S/N,"RUA GENERAL MANOEL RABELO S/N, VILA SÃO LUIS, DUQUE DE CAXIAS, Rio de Janeiro",110,FACULDADE DE EDUCACAO DA BAIXADA FLUMINENSE - UERJ,DUQUE DE CAXIAS,1155,0.21,0.0,0.02,0.0,0.68,0.09,74,0,8,0,238,30,200
69,82,87,266,GRAMACHO,25035185,58335,"RUA JOAQUIM JOSE SOARES, N 273","RUA JOAQUIM JOSE SOARES, N 273, GRAMACHO, DUQUE DE CAXIAS, Rio de Janeiro",115,CENSA -  CENTRO EDUCACIONAL DE CAXIAS NOSSA SRA APARECIDA,DUQUE DE CAXIAS,1287,0.33,0.0,0.03,0.0,0.57,0.08,36,0,7,0,151,21,194
70,197,69,385,VILA MARIA HELENA,25251600,58335,RUA EUSTAQUIO DE AZEVEDO S/N,"RUA EUSTAQUIO DE AZEVEDO S/N, VILA MARIA HELENA, DUQUE DE CAXIAS, Rio de Janeiro",118,CIEP 370 PROFESSOR SYLVIO GNECCO DE CARVALHO,DUQUE DE CAXIAS,1635,0.18,0.0,0.03,0.0,0.69,0.09,329,0,13,0,267,36,126
76,84,93,286,PARADA ANGÉLICA,25272230,58335,"RUA REAL DA ESTRELA, S/N","RUA REAL DA ESTRELA, S/N, PARADA ANGÉLICA, DUQUE DE CAXIAS, Rio de Janeiro",126,CIEP 407 - NEUZA GOULART BRIZOLA,DUQUE DE CAXIAS,1074,0.33,0.0,0.04,0.0,0.56,0.07,44,0,12,0,160,21,127
64,164,84,365,SANTA CRUZ DA SERRA,25251740,58335,RODOVIA WASHINGTON LUIZ S/N,"RODOVIA WASHINGTON LUIZ S/N, SANTA CRUZ DA SERRA, DUQUE DE CAXIAS, Rio de Janeiro",137,CIEP MONTEIRO LOBATO,DUQUE DE CAXIAS,1147,0.23,0.0,0.03,0.0,0.62,0.12,71,0,11,0,228,42,128
142,113,108,398,SÃO BENTO,25045000,58335,AV. PRESIDENTE KENNEDY S/N,"AV. PRESIDENTE KENNEDY S/N, SÃO BENTO, DUQUE DE CAXIAS, Rio de Janeiro",143,CIEP 118 VEREADOR VILSON CAMPOS MACEDO,DUQUE DE CAXIAS,1783,0.27,0.0,0.03,0.0,0.64,0.06,116,0,10,0,255,25,79
130,57,102,326,SÃO BENTO,25045000,58335,AV. PRESIDENTE KENNEDY S/N,"AV. PRESIDENTE KENNEDY S/N, SÃO BENTO, DUQUE DE CAXIAS, Rio de Janeiro",139,CIEP 201 AARAO STEINBRUCH,DUQUE DE CAXIAS,1910,0.31,0.0,0.03,0.0,0.57,0.08,148,0,10,0,187,27,79
138,101,69,381,JARDIM PRIMAVERA,25210000,58335,RUA ODESSA 546,"RUA ODESSA 546, JARDIM PRIMAVERA, DUQUE DE CAXIAS, Rio de Janeiro",142,COLEGIO ESTADUAL HELIO RANGEL,DUQUE DE CAXIAS,1368,0.18,0.0,0.06,0.0,0.63,0.13,180,0,22,0,239,51,126
105,109,74,346,VILA SÃO LUIS,25065050,58335,RUA GENERAL MANOEL RABELO S/N,"RUA GENERAL MANOEL RABELO S/N, VILA SÃO LUIS, DUQUE DE CAXIAS, Rio de Janeiro",132,FACULDADE DE EDUCACAO DA BAIXADA FLUMINENSE - UERJ,DUQUE DE CAXIAS,1155,0.21,0.0,0.04,0.0,0.62,0.12,110,0,15,0,214,43,200
74,60,53,225,JARDIM PRIMAVERA,25215340,58335,"AV. PRIMAVERA, QD 20/22","AV. PRIMAVERA, QD 20/22, JARDIM PRIMAVERA, DUQUE DE CAXIAS, Rio de Janeiro",91,ESCOLA MUNICIPAL REGINA CELI DA SILVA CERDEIRA,DUQUE DE CAXIAS,1074,0.24,0.0,0.04,0.0,0.6,0.12,46,0,10,0,134,28,126
88,152,66,366,IMBARIÊ,25275300,58335,"RUA 14 DE JULHO, LT 13 QD 67","RUA 14 DE JULHO, LT 13 QD 67, IMBARIÊ, DUQUE DE CAXIAS, Rio de Janeiro",126,ESCOLA MUNICIPAL PAULO RODRIGUES PEREIRA,DUQUE DE CAXIAS,1180,0.18,0.0,0.05,0.0,0.66,0.12,144,0,17,0,240,43,127
97,95,63,293,VILA SÃO LUIS,25065050,58335,RUA GENERAL MANOEL RABELO S/N,"RUA GENERAL MANOEL RABELO S/N, VILA SÃO LUIS, DUQUE DE CAXIAS, Rio de Janeiro",101,FACULDADE DE EDUCACAO DA BAIXADA FLUMINENSE - UERJ,DUQUE DE CAXIAS,1155,0.22,0.0,0.01,0.0,0.66,0.12,72,0,3,0,192,35,200
71,224,55,377,XERÉM,25250310,58335,ESTRADA DA IGREJA VELHA-F.N.M. S/N,"ESTRADA DA IGREJA VELHA-F.N.M. S/N, XERÉM, DUQUE DE CAXIAS, Rio de Janeiro",82,ESCOLA ESTADUAL SANTO ANTONIO,DUQUE DE CAXIAS,1090,0.15,0.0,0.01,0.0,0.78,0.06,37,0,5,0,295,22,128
102,62,75,268,VILA SÃO LUIS,25065030,58335,"RUA DOUTOR CARLOS ESTEVES, 216","RUA DOUTOR CARLOS ESTEVES, 216, VILA SÃO LUIS, DUQUE DE CAXIAS, Rio de Janeiro",104,CENTRO EDUCACIONAL BERBERT BARROS,DUQUE DE CAXIAS,1392,0.28,0.0,0.02,0.0,0.61,0.09,58,0,6,0,164,23,200
106,155,84,400,PILAR,25233170,58335,RUA COMENDADOR SILVA CARDOSO S/N,"RUA COMENDADOR SILVA CARDOSO S/N, PILAR, DUQUE DE CAXIAS, Rio de Janeiro",139,ESCOLA MUNICIPAL PROFESSORA AMÉLIA CÂMARA,DUQUE DE CAXIAS,2216,0.21,0.0,0.04,0.0,0.65,0.1,649,0,16,0,261,39,79
111,100,76,332,VILA SÃO LUIS,25065050,58335,"PRAÇA DA BANDEIRA, S/N","PRAÇA DA BANDEIRA, S/N, VILA SÃO LUIS, DUQUE DE CAXIAS, Rio de Janeiro",121,ESCOLA MUNICIPAL EXPEDICIONÁRIO AQUINO DE ARAÚJO,DUQUE DE CAXIAS,1198,0.23,0.0,0.03,0.0,0.64,0.11,169,0,10,0,211,35,78
131,112,68,382,VILA SÃO LUIS,25065030,58335,RUA DEPUTADO SA REGO S/N  (ESQ. COM R. PAULO DE FRONTIN),"RUA DEPUTADO SA REGO S/N  (ESQ. COM R. PAULO DE FRONTIN), VILA SÃO LUIS, DUQUE DE CAXIAS, Rio de Janeiro",139,ESCOLA ESTADUAL EUCLIDES DA CUNHA,DUQUE DE CAXIAS,1171,0.18,0.0,0.04,0.0,0.64,0.15,126,0,15,0,243,56,200
46,60,48,185,NOVA CAMPINAS,25265000,58335,"AV. A, S/N - QD 93","AV. A, S/N - QD 93, NOVA CAMPINAS, DUQUE DE CAXIAS, Rio de Janeiro",79,CRECHE E PRÉ-ESCOLA MUNICIPAL PROFESSORA ARMANDA ÁLVARO ALBERTO,DUQUE DE CAXIAS,1309,0.26,0.0,0.06,0.0,0.57,0.11,240,0,11,0,106,20,127
63,196,57,379,TAQUARA,25270000,58335,"RUA GENERAL FRANCISCO DE LIMA E SILVA, S/N","RUA GENERAL FRANCISCO DE LIMA E SILVA, S/N, TAQUARA, DUQUE DE CAXIAS, Rio de Janeiro",120,ESCOLA MUNICIPAL PROFESSORA MARIA DE ARAÚJO DA SILVA - BRIZOLINHA,DUQUE DE CAXIAS,1163,0.15,0.0,0.03,0.0,0.68,0.14,95,0,11,0,259,52,127
196,71,78,391,PARQUE LAFAIETE,25015100,58335,RUA EXP. AQUINO DE ARAUJO S/N ESQ. RUA RISOLETA CAETANO,"RUA EXP. AQUINO DE ARAUJO S/N ESQ. RUA RISOLETA CAETANO, PARQUE LAFAIETE, DUQUE DE CAXIAS, Rio de Janeiro",124,ESCOLA MUNICIPAL TODOS OS SANTOS,DUQUE DE CAXIAS,1503,0.2,0.0,0.03,0.0,0.68,0.09,193,0,10,0,267,36,103
51,113,87,266,CAPIVARI,25243150,58335,PRACA SAO LOURENCO 112,"PRACA SAO LOURENCO 112, CAPIVARI, DUQUE DE CAXIAS, Rio de Janeiro",102,ESCOLA MUNICIPAL PRESIDENTE COSTA E SILVA,DUQUE DE CAXIAS,1406,0.33,0.0,0.02,0.0,0.62,0.04,191,0,4,0,164,11,126
72,75,44,219,CENTRO,25020150,58335,"RUA JOSE DE ALVARENGA, 642","RUA JOSE DE ALVARENGA, 642, CENTRO, DUQUE DE CAXIAS, Rio de Janeiro",72,IPMDC-INSTITUTO DE PREVIDENCIA MUNICIPAL DE DUQUE DE CAXIAS,DUQUE DE CAXIAS,1171,0.2,0.0,0.02,0.0,0.67,0.11,130,0,5,0,147,23,103
76,98,78,294,CENTRO,25020100,58335,RUA BELISARIO PENA 273,"RUA BELISARIO PENA 273, CENTRO, DUQUE DE CAXIAS, Rio de Janeiro",120,ESCOLA MUNICIPAL ALVARO ALBERTO,DUQUE DE CAXIAS,1155,0.27,0.0,0.03,0.0,0.59,0.11,61,0,9,0,174,33,103
112,117,80,355,CENTENÁRIO,25030160,58335,"R. JOÃO RIBEIRO, 73","R. JOÃO RIBEIRO, 73, CENTENÁRIO, DUQUE DE CAXIAS, Rio de Janeiro",126,JARDIM ESCOLA LUZ E SABER,DUQUE DE CAXIAS,1376,0.23,0.0,0.03,0.0,0.65,0.1,33,0,10,0,229,36,77
92,112,74,332,VILA SÃO LUIS,25065050,58335,"PRAÇA DA BANDEIRA, S/N","PRAÇA DA BANDEIRA, S/N, VILA SÃO LUIS, DUQUE DE CAXIAS, Rio de Janeiro",128,ESCOLA MUNICIPAL EXPEDICIONÁRIO AQUINO DE ARAÚJO,DUQUE DE CAXIAS,1198,0.22,0.0,0.02,0.0,0.61,0.15,121,0,5,0,204,49,78
100,104,80,326,COPACABANA,25060445,58335,AV PREFEITO BRAULINO DE MATOS REIS 1410,"AV PREFEITO BRAULINO DE MATOS REIS 1410, COPACABANA, DUQUE DE CAXIAS, Rio de Janeiro",122,ESCOLA MUNICIPAL WILSON DE OLIVEIRA SIMÕES (LICEU),DUQUE DE CAXIAS,1040,0.25,0.0,0.03,0.0,0.63,0.1,140,0,9,0,204,33,78
152,124,61,393,JARDIM OLAVO BILAC,25036460,58335,"PRAÇA OTÁVIO CARNEIRO, LOTE 14, QUADRA 12","PRAÇA OTÁVIO CARNEIRO, LOTE 14, QUADRA 12, JARDIM OLAVO BILAC, DUQUE DE CAXIAS, Rio de Janeiro",117,ASSOCIAÇÃO EDUCACIONAL COLÉGIO OLAVO BILAC,DUQUE DE CAXIAS,1155,0.16,0.0,0.04,0.0,0.7,0.11,83,0,14,0,276,42,194
142,109,161,462,JARDIM 25 DE AGOSTO,25075025,58335,RUA MARECHAL FLORIANO 555,"RUA MARECHAL FLORIANO 555, JARDIM 25 DE AGOSTO, DUQUE DE CAXIAS, Rio de Janeiro",211,CEDERJ - CENTRO DE EDUCAÇÃO SUPERIOR À DISTÂNCIA (ANT COL SANTA LUZIA),DUQUE DE CAXIAS,1040,0.35,0.0,0.02,0.0,0.54,0.09,9,0,10,0,251,40,66
150,109,71,394,JARDIM OLAVO BILAC,25036040,58335,RUA CASSIPORE LOTE 27 QD 92,"RUA CASSIPORE LOTE 27 QD 92, JARDIM OLAVO BILAC, DUQUE DE CAXIAS, Rio de Janeiro",135,JARDIM ESCOLA REINO DA CULTURA - PREDIO I,DUQUE DE CAXIAS,1163,0.18,0.0,0.06,0.0,0.66,0.1,112,0,23,0,259,41,194
99,153,91,393,DOUTOR LAUREANO,25050580,58335,AV. CHOPIN S/N,"AV. CHOPIN S/N, DOUTOR LAUREANO, DUQUE DE CAXIAS, Rio de Janeiro",141,CIEP CHARLES CHAPLIN,DUQUE DE CAXIAS,1295,0.23,0.0,0.02,0.0,0.64,0.1,162,0,9,0,252,41,78
63,100,35,227,NOVA CAMPINAS,25265000,58335,"AV. A, S/N","AV. A, S/N, NOVA CAMPINAS, DUQUE DE CAXIAS, Rio de Janeiro",64,CIEP 476 - ELIAS LAZARONI,DUQUE DE CAXIAS,1287,0.15,0.0,0.02,0.0,0.72,0.11,257,0,5,0,163,24,127
81,126,70,337,NOVA CAMPINAS,25260000,58335,"AVENIDA A, S/N","AVENIDA A, S/N, NOVA CAMPINAS, DUQUE DE CAXIAS, Rio de Janeiro",130,ESCOLA ESTADUAL NOVA CAMPINAS,DUQUE DE CAXIAS,1376,0.21,0.0,0.04,0.0,0.61,0.14,195,0,14,0,207,46,127
133,105,117,396,25 DE AGOSTO,25071181,58335,"AVENIDA BRIGADEIRO LIMA E SILVA, 1411","AVENIDA BRIGADEIRO LIMA E SILVA, 1411, 25 DE AGOSTO, DUQUE DE CAXIAS, Rio de Janeiro",158,BANCO ITAÚ - AGÊNCIA 9165 - PRAÇA HUMAITÁ,DUQUE DE CAXIAS,1279,0.3,0.0,0.02,0.0,0.6,0.08,31,0,8,0,238,33,66
132,105,121,396,JARDIM 25 DE AGOSTO,25075142,58335,"RUA PROF. JOSÉ DE SOUZA HERDY, 450","RUA PROF. JOSÉ DE SOUZA HERDY, 450, JARDIM 25 DE AGOSTO, DUQUE DE CAXIAS, Rio de Janeiro",159,COLÉGIO ESTADUAL PROFESSOR JOSÉ DE SOUZA HERDY,DUQUE DE CAXIAS,1058,0.31,0.0,0.01,0.0,0.6,0.09,27,0,3,0,237,35,66
87,120,64,315,CORTE OITO,25030060,58335,"RUA PETRÓPOLIS, 405","RUA PETRÓPOLIS, 405, CORTE OITO, DUQUE DE CAXIAS, Rio de Janeiro",108,ESCOLA MUNICIPAL GASTÃO REIS,DUQUE DE CAXIAS,1120,0.2,0.0,0.03,0.0,0.66,0.11,122,0,8,0,207,36,77
126,116,78,382,PARADA ANGÉLICA,25272540,58335,"RUA LÚCIA HELENA FACCINI, 08","RUA LÚCIA HELENA FACCINI, 08, PARADA ANGÉLICA, DUQUE DE CAXIAS, Rio de Janeiro",140,ESCOLA MUNICIPAL MARECHAL FLORIANO PEIXOTO,DUQUE DE CAXIAS,1090,0.2,0.0,0.04,0.0,0.63,0.12,53,0,17,0,242,45,127
137,108,81,385,SANTA LÚCIA,25275450,58335,"AV. FELICIANO SODRÉ, S/N","AV. FELICIANO SODRÉ, S/N, SANTA LÚCIA, DUQUE DE CAXIAS, Rio de Janeiro",140,CIEP 171 - JOSÉ AMÉRICO PESSANHA,DUQUE DE CAXIAS,1015,0.21,0.0,0.05,0.0,0.64,0.1,154,0,21,0,245,38,127
