DICA,WASHINGTON REIS,abstencoes,aptos,bairro,cep,codigo_municipio,endereco,location,nao_considerados,nome_local,nome_munic,num_local,percentual_abstencoes,percentual_anulados,percentual_brancos,percentual_legenda,percentual_nominais,percentual_nulos,secao,votos_anulados,votos_brancos,votos_legenda,votos_nominais,votos_nulos,zona
40,219,66,354,XERÉM,25070000,58335,PRACA PREF. ROBERTO SILVEIRA S/N,"PRACA PREF. ROBERTO SILVEIRA S/N, XERÉM, DUQUE DE CAXIAS, Rio de Janeiro",95,ESCOLA ESTADUAL CIRCULO OPERARIO,DUQUE DE CAXIAS,1236,0.19,0.0,0.01,0.0,0.73,0.07,98,0,3,0,259,26,128
112,122,78,352,DOUTOR LAUREANO,25065170,58335,RUA LEANDRO DA MOTA 159,"RUA LEANDRO DA MOTA 159, DOUTOR LAUREANO, DUQUE DE CAXIAS, Rio de Janeiro",118,CRECHE MUN. GRACIESSE LUÍSA SILVA LOURENÇO(CRUZEIRO DO SUL),DUQUE DE CAXIAS,1090,0.22,0.0,0.03,0.0,0.66,0.09,40,0,10,0,234,30,78
111,98,62,310,SANTA TERESA,25086030,58335,"ESTRADA SÃO VICENTE, 98","ESTRADA SÃO VICENTE, 98, SANTA TERESA, DUQUE DE CAXIAS, Rio de Janeiro",101,CIEP 098 PROFESSORA HILDA DO CARMO SIQUEIRA,DUQUE DE CAXIAS,1015,0.2,0.0,0.02,0.0,0.67,0.11,7,0,5,0,209,34,200
118,133,80,400,SANTA LÚCIA,25271000,58335,"AV. AUTOMÓVEL CLUB, KM 56","AV. AUTOMÓVEL CLUB, KM 56, SANTA LÚCIA, DUQUE DE CAXIAS, Rio de Janeiro",149,CIEP 330 - MARIA DA GLÓRIA CORREA LEMOS - ESMERALDO BERÇÁCOLLO,DUQUE DE CAXIAS,1325,0.2,0.0,0.04,0.0,0.63,0.13,167,0,17,0,251,52,127
129,83,129,375,CENTRO,25010000,58335,AV. PRESIDENTE KENNEDY 514,"AV. PRESIDENTE KENNEDY 514, CENTRO, DUQUE DE CAXIAS, Rio de Janeiro",163,COLEGIO FUTURO VIP (ANTIGO CURSO GPI),DUQUE DE CAXIAS,1058,0.34,0.0,0.02,0.0,0.57,0.07,19,0,8,0,212,26,103
45,199,79,371,JARDIM ROTSEN,25272030,58335,"AV. AUTOMÓVEL CLUB, S/N KM 52","AV. AUTOMÓVEL CLUB, S/N KM 52, JARDIM ROTSEN, DUQUE DE CAXIAS, Rio de Janeiro",127,ESCOLA MUNICIPAL ALMIRANTE TAMANDARÉ,DUQUE DE CAXIAS,1384,0.21,0.0,0.03,0.0,0.66,0.1,218,0,12,0,244,36,127
70,175,89,383,FIGUEIRA,25230610,58335,"ESTRADA VELHA DO PILAR, N. 50","ESTRADA VELHA DO PILAR, N. 50, FIGUEIRA, DUQUE DE CAXIAS, Rio de Janeiro",138,ESCOLA MUNICIPAL PROFESSOR WALTER RUSSO DE SOUZA,DUQUE DE CAXIAS,1775,0.23,0.0,0.05,0.0,0.64,0.08,349,0,18,0,245,31,126
72,172,75,364,JARDIM ANHANGÁ,25264000,58335,"RUA VIOLETA, S/N","RUA VIOLETA, S/N, JARDIM ANHANGÁ, DUQUE DE CAXIAS, Rio de Janeiro",120,ESCOLA MUNICIPAL GENERAL MOURÃO FILHO,DUQUE DE CAXIAS,1058,0.21,0.0,0.03,0.0,0.67,0.09,173,0,11,0,244,34,127
75,183,52,379,TAQUARA,25270000,58335,"RUA GENERAL FRANCISCO DE LIMA E SILVA, S/N","RUA GENERAL FRANCISCO DE LIMA E SILVA, S/N, TAQUARA, DUQUE DE CAXIAS, Rio de Janeiro",121,ESCOLA MUNICIPAL PROFESSORA MARIA DE ARAÚJO DA SILVA - BRIZOLINHA,DUQUE DE CAXIAS,1163,0.14,0.0,0.04,0.0,0.68,0.14,92,0,17,0,258,52,127
178,114,95,425,PARQUE FLUMINENSE,25045270,58335,RUA JOSE DE AZEVEDO 156,"RUA JOSE DE AZEVEDO 156, PARQUE FLUMINENSE, DUQUE DE CAXIAS, Rio de Janeiro",133,ESCOLA MUNICIPAL PAULO FREIRE,DUQUE DE CAXIAS,1180,0.22,0.0,0.03,0.0,0.69,0.06,89,0,13,0,292,25,79
99,143,103,394,JARDIM GRAMACHO,25055340,58335,"RUA CARAMURU, 84","RUA CARAMURU, 84, JARDIM GRAMACHO, DUQUE DE CAXIAS, Rio de Janeiro",152,ESCOLA MUNICIPAL MAURO DE CASTRO,DUQUE DE CAXIAS,1350,0.26,0.0,0.03,0.0,0.61,0.1,68,0,11,0,242,38,78
139,105,101,390,JARDIM 25 DE AGOSTO,25071190,58335,"RUA MARECHAL DEODORO, 477","RUA MARECHAL DEODORO, 477, JARDIM 25 DE AGOSTO, DUQUE DE CAXIAS, Rio de Janeiro",146,CLUB DOS 500,DUQUE DE CAXIAS,1031,0.26,0.0,0.03,0.0,0.63,0.09,166,0,10,0,244,35,66
85,139,112,381,SARAPUÍ,25050100,58335,"AV REPUBLICA DO PARAGUAI, S/N","AV REPUBLICA DO PARAGUAI, S/N, SARAPUÍ, DUQUE DE CAXIAS, Rio de Janeiro",157,CIEP CARLOS CHAGAS,DUQUE DE CAXIAS,1163,0.29,0.0,0.03,0.0,0.59,0.09,71,0,11,0,224,34,78
72,76,75,240,ITATIAIA,25070000,58335,RUA ALBERTO TORRES 155,"RUA ALBERTO TORRES 155, ITATIAIA, DUQUE DE CAXIAS, Rio de Janeiro",92,FUNDAÇÃO DE APOIO À ESCOLA TÉCNICA - FAETEC,DUQUE DE CAXIAS,1074,0.31,0.0,0.0,0.0,0.62,0.07,45,0,1,0,148,16,200
39,197,100,354,MANTIQUIRA,25245710,58335,RUA EDIR BARBOSA 21,"RUA EDIR BARBOSA 21, MANTIQUIRA, DUQUE DE CAXIAS, Rio de Janeiro",118,ESCOLA ESTADUAL MONTEIRO LOBATO,DUQUE DE CAXIAS,1112,0.28,0.0,0.01,0.0,0.67,0.04,50,0,3,0,236,15,128
99,65,49,252,CENTRO,25010180,58335,"RUA DEPUTADO SOARES FILHO,218","RUA DEPUTADO SOARES FILHO,218, CENTRO, DUQUE DE CAXIAS, Rio de Janeiro",88,PRIMEIRA IGREJA BATISTA DE DUQUE DE CAXIAS,DUQUE DE CAXIAS,1481,0.19,0.0,0.01,0.0,0.65,0.14,105,0,3,0,164,36,103
83,136,103,367,IMBARIÊ,25275300,58335,"RUA 14 DE JULHO, LT 13 QD 67","RUA 14 DE JULHO, LT 13 QD 67, IMBARIÊ, DUQUE DE CAXIAS, Rio de Janeiro",148,ESCOLA MUNICIPAL PAULO RODRIGUES PEREIRA,DUQUE DE CAXIAS,1180,0.28,0.0,0.02,0.0,0.6,0.1,100,0,9,0,219,36,127
52,142,42,280,CAPIVARI,25243574,58335,RUA MANZANARES S/N,"RUA MANZANARES S/N, CAPIVARI, DUQUE DE CAXIAS, Rio de Janeiro",86,ESCOLA ESTADUAL ABDALA CHAMA,DUQUE DE CAXIAS,1490,0.15,0.0,0.04,0.0,0.69,0.12,244,0,11,0,194,33,126
129,113,68,394,JARDIM PRIMAVERA,25212310,58335,RUA LEIBRITZ S/N,"RUA LEIBRITZ S/N, JARDIM PRIMAVERA, DUQUE DE CAXIAS, Rio de Janeiro",152,CIEP 035 MARECHAL HENRIQUE TEIXEIRA LOTT,DUQUE DE CAXIAS,1082,0.17,0.0,0.05,0.0,0.61,0.16,56,0,19,0,242,65,126
118,175,69,394,JARDIM GRAMACHO,25055030,58335,RUA CONDEUBA S/N,"RUA CONDEUBA S/N, JARDIM GRAMACHO, DUQUE DE CAXIAS, Rio de Janeiro",101,ESCOLA MUNICIPAL JARDIM GRAMACHO,DUQUE DE CAXIAS,1309,0.18,0.0,0.02,0.0,0.74,0.06,154,0,7,0,293,25,78
85,95,88,316,VILA SÃO LUIS,25065090,58335,RUA EXPEDICIONARIO JOSE AMARO 305,"RUA EXPEDICIONARIO JOSE AMARO 305, VILA SÃO LUIS, DUQUE DE CAXIAS, Rio de Janeiro",136,EDUCANDÁRIO SANTA CECÍLIA,DUQUE DE CAXIAS,1210,0.28,0.0,0.03,0.0,0.57,0.12,97,0,11,0,180,37,78
151,89,82,369,PAULICÉIA,25070015,58335,"RUA ARTUR NEIVA, 100","RUA ARTUR NEIVA, 100, PAULICÉIA, DUQUE DE CAXIAS, Rio de Janeiro",129,SESI,DUQUE DE CAXIAS,1139,0.22,0.0,0.02,0.0,0.65,0.11,60,0,8,0,240,39,200
40,243,69,377,XERÉM,25245410,58335,RUA ENEAS FRUTUOSO S/N,"RUA ENEAS FRUTUOSO S/N, XERÉM, DUQUE DE CAXIAS, Rio de Janeiro",94,CIEP 338 - CELIA RABELO,DUQUE DE CAXIAS,1244,0.18,0.0,0.02,0.0,0.75,0.05,146,0,6,0,283,19,128
176,56,110,391,PARQUE LAGUNA E DOURADOS,25085420,58335,"AV. DR. MANOEL TELLES, S/N","AV. DR. MANOEL TELLES, S/N, PARQUE LAGUNA E DOURADOS, DUQUE DE CAXIAS, Rio de Janeiro",159,CENTRO EDUCACIONAL COLEGIO CARLOS GOMES (QUADRA),DUQUE DE CAXIAS,1325,0.28,0.0,0.05,0.0,0.59,0.08,141,0,18,0,232,31,103
141,98,114,399,SÃO BENTO,25045010,58335,AV. PRESIDENTE KENNEDY 9422,"AV. PRESIDENTE KENNEDY 9422, SÃO BENTO, DUQUE DE CAXIAS, Rio de Janeiro",160,FEUDUC,DUQUE DE CAXIAS,1252,0.29,0.0,0.02,0.0,0.6,0.1,114,0,7,0,239,39,79
84,80,75,272,PARQUE PAULICÉIA,25071000,58335,RUA PARANA 739,"RUA PARANA 739, PARQUE PAULICÉIA, DUQUE DE CAXIAS, Rio de Janeiro",108,ESCOLA MUNICIPAL MOTA SOBRINHO,DUQUE DE CAXIAS,1023,0.28,0.0,0.03,0.0,0.6,0.09,13,0,9,0,164,24,200
60,50,103,233,JARDIM OLAVO BILAC,25035800,58335,RUA PEDRO LESSA LT 16/17 QD 12,"RUA PEDRO LESSA LT 16/17 QD 12, JARDIM OLAVO BILAC, DUQUE DE CAXIAS, Rio de Janeiro",123,QUADRA ASSOCIAÇÃO EDUCACIONAL COLEGIO OLAVO BILAC,DUQUE DE CAXIAS,1104,0.44,0.0,0.02,0.0,0.47,0.07,57,0,4,0,110,16,194
127,122,68,396,JARDIM PRIMAVERA,25215255,58335,AV. EMILIO DE MENEZES S/N,"AV. EMILIO DE MENEZES S/N, JARDIM PRIMAVERA, DUQUE DE CAXIAS, Rio de Janeiro",147,CIEP 369 JORNALISTA SANDRO MOREYRA,DUQUE DE CAXIAS,1104,0.17,0.0,0.04,0.0,0.63,0.16,353,0,16,0,249,63,126
66,173,80,377,CHACARAS ARCAMPO,25251070,58335,"RUA DO SERRADO, SN","RUA DO SERRADO, SN, CHACARAS ARCAMPO, DUQUE DE CAXIAS, Rio de Janeiro",138,ESCOLA MUNICIPAL MEXICO,DUQUE DE CAXIAS,1260,0.21,0.0,0.03,0.0,0.63,0.12,151,0,11,0,239,47,128
142,90,103,376,JARDIM 25 DE AGOSTO,25075015,58335,"RUA MAJOR CORRÊA DE MELO, 86","RUA MAJOR CORRÊA DE MELO, 86, JARDIM 25 DE AGOSTO, DUQUE DE CAXIAS, Rio de Janeiro",144,ESTÁCIO,DUQUE DE CAXIAS,1090,0.27,0.0,0.03,0.0,0.62,0.07,42,0,13,0,232,28,66
181,75,87,395,PARQUE LAFAIETE,25025010,58335,RUA DAVID DE OLIVEIRA S/N,"RUA DAVID DE OLIVEIRA S/N, PARQUE LAFAIETE, DUQUE DE CAXIAS, Rio de Janeiro",139,ESCOLA MUNICIPAL SANTA TEREZINHA,DUQUE DE CAXIAS,1490,0.22,0.0,0.02,0.0,0.65,0.12,225,0,6,0,256,46,103
60,196,54,359,JARDIM ANHANGÁ,25264350,58335,"AV. ANHANGÁ, S/N","AV. ANHANGÁ, S/N, JARDIM ANHANGÁ, DUQUE DE CAXIAS, Rio de Janeiro",103,CIEP 319 - ODUVALDO VIANA FILHO,DUQUE DE CAXIAS,1244,0.15,0.0,0.03,0.0,0.71,0.1,123,0,12,0,256,37,127
125,106,107,390,JARDIM 25 DE AGOSTO,25071202,58335,"RUA PROF. JOSÉ DE SOUZA HERDY, 1160","RUA PROF. JOSÉ DE SOUZA HERDY, 1160, JARDIM 25 DE AGOSTO, DUQUE DE CAXIAS, Rio de Janeiro",159,UNIGRANRIO,DUQUE DE CAXIAS,1015,0.27,0.0,0.03,0.0,0.59,0.1,173,0,12,0,231,40,66
152,141,105,476,JARDIM 25 DE AGOSTO,25075025,58335,RUA MARECHAL FLORIANO 555,"RUA MARECHAL FLORIANO 555, JARDIM 25 DE AGOSTO, DUQUE DE CAXIAS, Rio de Janeiro",183,CEDERJ - CENTRO DE EDUCAÇÃO SUPERIOR À DISTÂNCIA (ANT COL SANTA LUZIA),DUQUE DE CAXIAS,1040,0.22,0.0,0.04,0.0,0.62,0.13,170,0,17,0,293,61,66
112,99,96,342,JARDIM LEAL,25035570,58335,RUA SOLANGE 7,"RUA SOLANGE 7, JARDIM LEAL, DUQUE DE CAXIAS, Rio de Janeiro",131,CIEP JARDIM LEAL,DUQUE DE CAXIAS,1031,0.28,0.0,0.01,0.0,0.62,0.09,9,0,5,0,211,30,194
128,130,76,397,DOUTOR LAUREANO,25050580,58335,AV. CHOPIN S/N,"AV. CHOPIN S/N, DOUTOR LAUREANO, DUQUE DE CAXIAS, Rio de Janeiro",139,CIEP CHARLES CHAPLIN,DUQUE DE CAXIAS,1295,0.19,0.0,0.03,0.0,0.65,0.13,168,0,12,0,258,51,78
133,79,69,329,PANTANAL,25040240,58335,RUA DELGADO CARVALHO LT 40 QD 52,"RUA DELGADO CARVALHO LT 40 QD 52, PANTANAL, DUQUE DE CAXIAS, Rio de Janeiro",117,CENTRO EDUCACIONAL SILVA TAVARES - ANT. ARCO ÍRIS,DUQUE DE CAXIAS,2135,0.21,0.0,0.04,0.0,0.64,0.11,580,0,12,0,212,36,79
170,90,106,400,PARQUE FLUMINENSE,25045100,58335,ESTRADA DO CHINA LOTE 10 QUADRA J,"ESTRADA DO CHINA LOTE 10 QUADRA J, PARQUE FLUMINENSE, DUQUE DE CAXIAS, Rio de Janeiro",140,ESCOLA ESTADUAL PROFESSORA CORDÉLIA PAIVA,DUQUE DE CAXIAS,2186,0.26,0.0,0.04,0.0,0.65,0.05,647,0,14,0,260,20,79
73,116,85,329,NOVA CAMPINAS,25211220,58335,"AV. A, S/N","AV. A, S/N, NOVA CAMPINAS, DUQUE DE CAXIAS, Rio de Janeiro",140,CIEP 227 - PROCÓPIO FERREIRA,DUQUE DE CAXIAS,1120,0.26,0.0,0.03,0.0,0.57,0.14,115,0,9,0,189,46,127
151,73,88,361,PARQUE LAGUNA E DOURADOS,25011320,58335,RUA JOSE LUIZ RODRIGUES CALAZANS 355,"RUA JOSE LUIZ RODRIGUES CALAZANS 355, PARQUE LAGUNA E DOURADOS, DUQUE DE CAXIAS, Rio de Janeiro",137,ESCOLA MUNICIPAL LAGUNAS E DOURADOS (PROFº. ROMEU MENEZES DOS SANTOS,DUQUE DE CAXIAS,1457,0.24,0.0,0.03,0.0,0.62,0.1,154,0,12,0,224,37,103
84,166,113,396,FIGUEIRA,25230020,58335,AV. DEMETRIO RIBEIRO S/N,"AV. DEMETRIO RIBEIRO S/N, FIGUEIRA, DUQUE DE CAXIAS, Rio de Janeiro",146,COLEGIO ESTADUAL FREI HENRIQUE DE COIMBRA,DUQUE DE CAXIAS,1414,0.29,0.0,0.03,0.0,0.63,0.06,200,0,11,0,250,22,126
90,132,121,389,SARAPUÍ,25050100,58335,"AV REPUBLICA DO PARAGUAI, S/N","AV REPUBLICA DO PARAGUAI, S/N, SARAPUÍ, DUQUE DE CAXIAS, Rio de Janeiro",167,CIEP CARLOS CHAGAS,DUQUE DE CAXIAS,1163,0.31,0.0,0.03,0.0,0.57,0.09,79,0,12,0,222,34,78
108,126,104,385,SARACURUNA,25220010,58335,RUA CORONEL CARLOS MATOS QD 3 LT. 22,"RUA CORONEL CARLOS MATOS QD 3 LT. 22, SARACURUNA, DUQUE DE CAXIAS, Rio de Janeiro",151,ESCOLA ESTADUAL VERA LÚCIA TAVARES ROMÃO,DUQUE DE CAXIAS,1465,0.27,0.0,0.03,0.0,0.61,0.09,226,0,13,0,234,34,126
94,155,74,381,SARAPUÍ,25050100,58335,"AV REPUBLICA DO PARAGUAI, S/N","AV REPUBLICA DO PARAGUAI, S/N, SARAPUÍ, DUQUE DE CAXIAS, Rio de Janeiro",132,CIEP CARLOS CHAGAS,DUQUE DE CAXIAS,1163,0.19,0.0,0.04,0.0,0.65,0.11,123,0,16,0,249,42,78
128,115,94,379,VILA SÃO LUIS,25065090,58335,AV PRESIDENTE TANCREDO NEVES 1067,"AV PRESIDENTE TANCREDO NEVES 1067, VILA SÃO LUIS, DUQUE DE CAXIAS, Rio de Janeiro",136,ESCOLA MUNICIPAL LIONS,DUQUE DE CAXIAS,1228,0.25,0.0,0.02,0.0,0.64,0.09,86,0,6,0,243,36,78
124,139,87,396,JARDIM PRIMAVERA,25223540,58335,PRACA NOSSA SENHORA DE LOURDES S/N,"PRACA NOSSA SENHORA DE LOURDES S/N, JARDIM PRIMAVERA, DUQUE DE CAXIAS, Rio de Janeiro",133,CIEP 209 ATAULPHO ALVES,DUQUE DE CAXIAS,1120,0.22,0.0,0.04,0.0,0.66,0.08,282,0,15,0,263,31,126
114,96,80,332,VILA SÃO LUIS,25065050,58335,"PRAÇA DA BANDEIRA, S/N","PRAÇA DA BANDEIRA, S/N, VILA SÃO LUIS, DUQUE DE CAXIAS, Rio de Janeiro",122,ESCOLA MUNICIPAL EXPEDICIONÁRIO AQUINO DE ARAÚJO,DUQUE DE CAXIAS,1198,0.24,0.0,0.02,0.0,0.63,0.11,161,0,5,0,210,37,78
118,93,64,312,VILA SÃO LUIS,25065090,58335,RUA EXPEDICIONARIO JOSE AMARO 305,"RUA EXPEDICIONARIO JOSE AMARO 305, VILA SÃO LUIS, DUQUE DE CAXIAS, Rio de Janeiro",101,EDUCANDÁRIO SANTA CECÍLIA,DUQUE DE CAXIAS,1210,0.21,0.0,0.01,0.0,0.68,0.11,153,0,4,0,211,33,78
60,154,120,360,JARDIM ANHANGÁ,25264000,58335,"RUA VIOLETA, S/N","RUA VIOLETA, S/N, JARDIM ANHANGÁ, DUQUE DE CAXIAS, Rio de Janeiro",146,ESCOLA MUNICIPAL GENERAL MOURÃO FILHO,DUQUE DE CAXIAS,1058,0.33,0.0,0.03,0.0,0.59,0.04,23,0,10,0,214,16,127
131,100,120,395,JARDIM PRIMAVERA,25212310,58335,RUA LEIBRITZ S/N,"RUA LEIBRITZ S/N, JARDIM PRIMAVERA, DUQUE DE CAXIAS, Rio de Janeiro",164,CIEP 035 MARECHAL HENRIQUE TEIXEIRA LOTT,DUQUE DE CAXIAS,1082,0.3,0.0,0.02,0.0,0.58,0.09,51,0,9,0,231,35,126
129,94,102,374,JARDIM 25 DE AGOSTO,25075015,58335,"RUA MAJOR CORRÊA DE MELO, 86","RUA MAJOR CORRÊA DE MELO, 86, JARDIM 25 DE AGOSTO, DUQUE DE CAXIAS, Rio de Janeiro",151,ESTÁCIO,DUQUE DE CAXIAS,1090,0.27,0.0,0.03,0.0,0.6,0.1,43,0,12,0,223,37,66
135,117,73,398,JARDIM PRIMAVERA,25223230,58335,RUA AMILCAR MARAPANIM S/N,"RUA AMILCAR MARAPANIM S/N, JARDIM PRIMAVERA, DUQUE DE CAXIAS, Rio de Janeiro",146,CIEP 208 ALCEU AMOROSO LIMA,DUQUE DE CAXIAS,1090,0.18,0.0,0.05,0.0,0.63,0.14,171,0,19,0,252,54,126
87,157,94,380,SARACURUNA,25220650,58335,RUA PEDRO I S/N,"RUA PEDRO I S/N, SARACURUNA, DUQUE DE CAXIAS, Rio de Janeiro",136,ESCOLA MUNICIPAL PEDRO RODRIGUES DO CARMO,DUQUE DE CAXIAS,1570,0.25,0.0,0.02,0.0,0.64,0.09,288,0,8,0,244,34,126
87,109,66,325,PARADA ANGÉLICA,25272540,58335,"RUA LÚCIA HELENA FACCINI, 08","RUA LÚCIA HELENA FACCINI, 08, PARADA ANGÉLICA, DUQUE DE CAXIAS, Rio de Janeiro",129,ESCOLA MUNICIPAL MARECHAL FLORIANO PEIXOTO,DUQUE DE CAXIAS,1090,0.2,0.0,0.04,0.0,0.6,0.15,133,0,14,0,196,49,127
45,239,46,355,MANTIQUIRA,25250570,58335,"RUA DR. OSMUNDO RIBEIRO DUARTE, S/N","RUA DR. OSMUNDO RIBEIRO DUARTE, S/N, MANTIQUIRA, DUQUE DE CAXIAS, Rio de Janeiro",71,ESCOLA MUNICIPAL SANTO AGOSTINHO,DUQUE DE CAXIAS,1155,0.13,0.0,0.01,0.0,0.8,0.06,122,0,4,0,284,21,128
70,190,68,382,VILA MARIA HELENA,25251600,58335,RUA EUSTAQUIO DE AZEVEDO S/N,"RUA EUSTAQUIO DE AZEVEDO S/N, VILA MARIA HELENA, DUQUE DE CAXIAS, Rio de Janeiro",122,CIEP 370 PROFESSOR SYLVIO GNECCO DE CARVALHO,DUQUE DE CAXIAS,1635,0.18,0.0,0.03,0.0,0.68,0.11,314,0,12,0,260,42,126
96,52,81,244,ENGENHO DO PORTO,25015190,58335,RUA COMANDANTE ARI PARREIRAS S/N,"RUA COMANDANTE ARI PARREIRAS S/N, ENGENHO DO PORTO, DUQUE DE CAXIAS, Rio de Janeiro",96,CIEP ANTONIETA CAMPOS DA PAZ (CIEP 434-MARIA JOSE MACHADO),DUQUE DE CAXIAS,1368,0.33,0.0,0.01,0.0,0.61,0.05,181,0,3,0,148,12,103
58,191,66,338,SANTO ANTONIO,25253550,58335,RUA MANOEL GARCIA DA SILVA S/N,"RUA MANOEL GARCIA DA SILVA S/N, SANTO ANTONIO, DUQUE DE CAXIAS, Rio de Janeiro",89,ESCOLA ESTADUAL HERVALINA DINIZ PIRES,DUQUE DE CAXIAS,1120,0.2,0.0,0.01,0.0,0.74,0.06,56,0,4,0,249,19,128
19,37,35,102,TAQUARA,25270000,58335,"PRAÇA SÃO PAULO, S/N","PRAÇA SÃO PAULO, S/N, TAQUARA, DUQUE DE CAXIAS, Rio de Janeiro",46,ESCOLA MUNICIPAL BARÃO DA TAQUARA,DUQUE DE CAXIAS,1333,0.34,0.0,0.0,0.0,0.55,0.11,182,0,0,0,56,11,127
69,167,101,378,TAQUARA,25270000,58335,"RUA GENERAL FRANCISCO DE LIMA E SILVA, S/N","RUA GENERAL FRANCISCO DE LIMA E SILVA, S/N, TAQUARA, DUQUE DE CAXIAS, Rio de Janeiro",142,ESCOLA MUNICIPAL PROFESSORA MARIA DE ARAÚJO DA SILVA - BRIZOLINHA,DUQUE DE CAXIAS,1163,0.27,0.0,0.02,0.0,0.62,0.09,90,0,7,0,236,34,127
143,100,107,397,PARQUE SANTA MARTA,25085210,58335,"RUA SOUZA RENHA, 09","RUA SOUZA RENHA, 09, PARQUE SANTA MARTA, DUQUE DE CAXIAS, Rio de Janeiro",154,ASCE CEI CENTRO EDUCACIONAL INTEGRADO,DUQUE DE CAXIAS,1023,0.27,0.0,0.03,0.0,0.61,0.09,12,0,10,0,243,37,66
97,104,89,333,VILA SÃO LUIS,25065050,58335,"PRAÇA DA BANDEIRA, S/N","PRAÇA DA BANDEIRA, S/N, VILA SÃO LUIS, DUQUE DE CAXIAS, Rio de Janeiro",132,ESCOLA MUNICIPAL EXPEDICIONÁRIO AQUINO DE ARAÚJO,DUQUE DE CAXIAS,1198,0.27,0.0,0.04,0.0,0.6,0.09,88,0,12,0,201,31,78
100,170,44,378,CAMPOS ELÍSEOS,25225000,58335,RUA DAS TAMARINDAS S/N,"RUA DAS TAMARINDAS S/N, CAMPOS ELÍSEOS, DUQUE DE CAXIAS, Rio de Janeiro",108,ESCOLA MUNICIPAL DOUTOR MANOEL REIS,DUQUE DE CAXIAS,1031,0.12,0.0,0.04,0.0,0.71,0.13,20,0,16,0,270,48,126
88,46,86,241,ENGENHO DO PORTO,25015190,58335,RUA COMANDANTE ARI PARREIRAS S/N,"RUA COMANDANTE ARI PARREIRAS S/N, ENGENHO DO PORTO, DUQUE DE CAXIAS, Rio de Janeiro",107,CIEP ANTONIETA CAMPOS DA PAZ (CIEP 434-MARIA JOSE MACHADO),DUQUE DE CAXIAS,1368,0.36,0.0,0.02,0.0,0.56,0.07,190,0,4,0,134,17,103
109,121,83,380,BANANAL,25036120,58335,"RUA DR. JOÃO CLEMENTINO, 817","RUA DR. JOÃO CLEMENTINO, 817, BANANAL, DUQUE DE CAXIAS, Rio de Janeiro",150,ESCOLA MUNICIPAL DARCY VARGAS,DUQUE DE CAXIAS,1023,0.22,0.0,0.04,0.0,0.61,0.14,7,0,15,0,230,52,194
80,78,96,300,ITATIAIA,25070000,58335,"RUA ALBERTO TORRES, 124","RUA ALBERTO TORRES, 124, ITATIAIA, DUQUE DE CAXIAS, Rio de Janeiro",142,EDUCANDARIO CRUZEIRO DO SUL,DUQUE DE CAXIAS,1066,0.32,0.0,0.02,0.0,0.53,0.13,35,0,6,0,158,40,200
94,163,80,397,CAMPOS ELÍSEOS,25225636,58335,RUA DO ROSARIO 119,"RUA DO ROSARIO 119, CAMPOS ELÍSEOS, DUQUE DE CAXIAS, Rio de Janeiro",140,INSTITUTO CULTURAL FLAVIO CASIMIRO,DUQUE DE CAXIAS,1660,0.2,0.0,0.03,0.0,0.65,0.13,304,0,10,0,257,50,126
182,72,116,398,PARQUE FELICIDADE,25080570,58335,"RUA BARBOSA ARAÚJO, 265","RUA BARBOSA ARAÚJO, 265, PARQUE FELICIDADE, DUQUE DE CAXIAS, Rio de Janeiro",144,ESCOLA MUNICIPAL ONERES NUNES DE OLIVEIRA - ANTIGO COLEGIO FLUMINENSE,DUQUE DE CAXIAS,1228,0.29,0.0,0.01,0.0,0.64,0.06,92,0,4,0,254,24,66
111,99,101,370,PAULICÉIA,25070015,58335,"RUA ARTUR NEIVA, 100","RUA ARTUR NEIVA, 100, PAULICÉIA, DUQUE DE CAXIAS, Rio de Janeiro",160,SESI,DUQUE DE CAXIAS,1139,0.27,0.0,0.03,0.0,0.57,0.13,89,0,12,0,210,47,200
133,105,79,397,CAMPOS ELÍSEOS,25225592,58335,RUA MARANHAO 90,"RUA MARANHAO 90, CAMPOS ELÍSEOS, DUQUE DE CAXIAS, Rio de Janeiro",159,ESCOLA MUNICIPAL MARILANDIA,DUQUE DE CAXIAS,1228,0.2,0.0,0.08,0.0,0.6,0.13,177,0,30,0,238,50,126
55,213,81,397,TAQUARA,25270000,58335,"PRAÇA SÃO PAULO, S/N","PRAÇA SÃO PAULO, S/N, TAQUARA, DUQUE DE CAXIAS, Rio de Janeiro",129,ESCOLA MUNICIPAL BARÃO DA TAQUARA,DUQUE DE CAXIAS,1333,0.2,0.0,0.04,0.0,0.68,0.08,208,0,16,0,268,32,127
137,103,124,398,PANTANAL,25040060,58335,AV. LAURO SODRE S/N,"AV. LAURO SODRE S/N, PANTANAL, DUQUE DE CAXIAS, Rio de Janeiro",158,CIEP GRACILIANO RAMOS,DUQUE DE CAXIAS,1376,0.31,0.0,0.02,0.0,0.6,0.07,175,0,8,0,240,26,79
142,95,88,393,JARDIM PRIMAVERA,25212360,58335,RUA SANTA RITA S/N,"RUA SANTA RITA S/N, JARDIM PRIMAVERA, DUQUE DE CAXIAS, Rio de Janeiro",156,ESCOLA ESTADUAL ALEXANDER GRAHAM BELL,DUQUE DE CAXIAS,1112,0.22,0.0,0.04,0.0,0.6,0.14,346,0,14,0,237,54,126
79,185,86,400,PARQUE PAULISTA,25261000,58335,"AV. 31 DE MARÇO, 88","AV. 31 DE MARÇO, 88, PARQUE PAULISTA, DUQUE DE CAXIAS, Rio de Janeiro",136,CIEP 015 - MUNICIPALIZADO HENRIQUE DE SOUZA FILHO - HENFIL,DUQUE DE CAXIAS,1279,0.22,0.0,0.04,0.0,0.66,0.08,129,0,16,0,264,34,127
143,117,88,396,VILA SÃO LUIS,25065005,58335,RUA DR. CARLOS ESTEVES S/N (ESQ. COM R. STA TERESA),"RUA DR. CARLOS ESTEVES S/N (ESQ. COM R. STA TERESA), VILA SÃO LUIS, DUQUE DE CAXIAS, Rio de Janeiro",136,ESCOLA MUNICIPAL MARECHAL MALLET,DUQUE DE CAXIAS,1031,0.22,0.0,0.03,0.0,0.66,0.09,122,0,12,0,260,36,200
157,118,66,395,VILA SÃO LUIS,25065172,58335,AV. BRASIL S/N (ESQ. COM R. QUATORZE DE JULHO),"AV. BRASIL S/N (ESQ. COM R. QUATORZE DE JULHO), VILA SÃO LUIS, DUQUE DE CAXIAS, Rio de Janeiro",120,ESCOLA ESTADUAL PROFESSORA LIA MARCIA GONÇALVES PANARO,DUQUE DE CAXIAS,1104,0.17,0.0,0.05,0.0,0.7,0.09,135,0,18,0,275,36,200
88,144,102,391,IMBARIÊ,25000000,58335,"RUA GOINDIRA, 379","RUA GOINDIRA, 379, IMBARIÊ, DUQUE DE CAXIAS, Rio de Janeiro",159,COLÉGIO ESTADUAL FERNANDO FIGUEIREDO,DUQUE DE CAXIAS,1031,0.26,0.0,0.06,0.0,0.59,0.08,15,0,24,0,232,33,127
166,71,51,322,BAR DOS CAVALEIROS,25015420,58335,RUA CAMPOS 55,"RUA CAMPOS 55, BAR DOS CAVALEIROS, DUQUE DE CAXIAS, Rio de Janeiro",85,ESCOLA MUNICIPAL PROF. HILDA DO CARMO SIQUEIRA,DUQUE DE CAXIAS,1384,0.16,0.0,0.01,0.0,0.74,0.1,206,0,2,0,237,32,103
58,178,91,383,VILA MARIA HELENA,25251600,58335,RUA EUSTAQUIO DE AZEVEDO S/N,"RUA EUSTAQUIO DE AZEVEDO S/N, VILA MARIA HELENA, DUQUE DE CAXIAS, Rio de Janeiro",147,CIEP 370 PROFESSOR SYLVIO GNECCO DE CARVALHO,DUQUE DE CAXIAS,1635,0.24,0.0,0.03,0.0,0.62,0.11,340,0,12,0,236,44,126
83,152,88,374,IMBARIÊ,25266250,58335,"AV. CORONEL SISSON, S/N","AV. CORONEL SISSON, S/N, IMBARIÊ, DUQUE DE CAXIAS, Rio de Janeiro",139,ESCOLA MUNICIPAL PROFESSORA CARMEM CORREA DE CARVALHO REIS BRÁZ,DUQUE DE CAXIAS,1198,0.24,0.0,0.04,0.0,0.63,0.1,109,0,14,0,235,37,127
38,138,57,275,SANTA CRUZ DA SERRA,25240000,58335,"RUA 20, LOTE 12, QUADRA 23","RUA 20, LOTE 12, QUADRA 23, SANTA CRUZ DA SERRA, DUQUE DE CAXIAS, Rio de Janeiro",99,ESCOLA MUNICIPAL PEDRO PAULO DA SILVA,DUQUE DE CAXIAS,1252,0.21,0.0,0.02,0.0,0.64,0.13,149,0,6,0,176,36,128
180,90,81,396,PANTANAL,25040060,58335,AV. LAURO SODRE S/N,"AV. LAURO SODRE S/N, PANTANAL, DUQUE DE CAXIAS, Rio de Janeiro",126,CIEP GRACILIANO RAMOS,DUQUE DE CAXIAS,1376,0.2,0.0,0.04,0.0,0.68,0.07,555,0,16,0,270,29,79
90,114,78,357,SARACURUNA,25220660,58335,RUA DO PORTO S/N,"RUA DO PORTO S/N, SARACURUNA, DUQUE DE CAXIAS, Rio de Janeiro",153,CIEP 228 DARCY VARGAS,DUQUE DE CAXIAS,1554,0.22,0.0,0.06,0.0,0.57,0.15,316,0,20,0,204,55,126
90,156,85,391,IMBARIÊ,25000000,58335,"RUA GOINDIRA, 379","RUA GOINDIRA, 379, IMBARIÊ, DUQUE DE CAXIAS, Rio de Janeiro",145,COLÉGIO ESTADUAL FERNANDO FIGUEIREDO,DUQUE DE CAXIAS,1031,0.22,0.0,0.04,0.0,0.63,0.11,209,0,17,0,246,43,127
31,253,84,395,AMAPÁ,25056110,58335,ESTRADA DO AMAPA S/N,"ESTRADA DO AMAPA S/N, AMAPÁ, DUQUE DE CAXIAS, Rio de Janeiro",111,CIEP 348 - EUGENIA MOREYRA,DUQUE DE CAXIAS,1600,0.21,0.0,0.02,0.0,0.72,0.05,638,0,6,0,284,21,79
101,144,101,393,GRAMACHO,25035240,58335,AV. RIO BRANCO 20,"AV. RIO BRANCO 20, GRAMACHO, DUQUE DE CAXIAS, Rio de Janeiro",148,ESCOLA MUNICIPAL RUY BARBOSA,DUQUE DE CAXIAS,1040,0.26,0.0,0.04,0.0,0.62,0.08,33,0,15,0,245,32,194
112,130,126,399,JARDIM PRIMAVERA,25223540,58335,PRACA NOSSA SENHORA DE LOURDES S/N,"PRACA NOSSA SENHORA DE LOURDES S/N, JARDIM PRIMAVERA, DUQUE DE CAXIAS, Rio de Janeiro",157,CIEP 209 ATAULPHO ALVES,DUQUE DE CAXIAS,1120,0.32,0.0,0.02,0.0,0.61,0.06,82,0,6,0,242,25,126
125,114,80,395,JARDIM PRIMAVERA,25213340,58335,RUA GERALDO ROCHA S/N,"RUA GERALDO ROCHA S/N, JARDIM PRIMAVERA, DUQUE DE CAXIAS, Rio de Janeiro",156,ESCOLA MUNICIPAL ANTON DWORSAK,DUQUE DE CAXIAS,1759,0.2,0.0,0.05,0.0,0.61,0.15,254,0,18,0,239,58,126
124,137,79,398,JARDIM PRIMAVERA,25223540,58335,PRACA NOSSA SENHORA DE LOURDES S/N,"PRACA NOSSA SENHORA DE LOURDES S/N, JARDIM PRIMAVERA, DUQUE DE CAXIAS, Rio de Janeiro",137,CIEP 209 ATAULPHO ALVES,DUQUE DE CAXIAS,1120,0.2,0.0,0.05,0.0,0.66,0.1,330,0,18,0,261,40,126
105,163,64,387,GRAMACHO,25035150,58335,"RUA VEREADOR TOME SIQUEIRA BARRETO, 295","RUA VEREADOR TOME SIQUEIRA BARRETO, 295, GRAMACHO, DUQUE DE CAXIAS, Rio de Janeiro",119,ESCOLA ESTADUAL AURA BARRETO,DUQUE DE CAXIAS,1058,0.17,0.0,0.04,0.0,0.69,0.1,24,0,16,0,268,39,194
117,116,60,322,PANTANAL,25040610,58335,ESTRADA DO CALUNDU S/N - N.S. DO CARMO,"ESTRADA DO CALUNDU S/N - N.S. DO CARMO, PANTANAL, DUQUE DE CAXIAS, Rio de Janeiro",89,ESCOLA MUNICIPAL EULINA PINTO DE BARROS,DUQUE DE CAXIAS,1430,0.19,0.0,0.05,0.0,0.72,0.04,648,0,16,0,233,13,79
63,218,71,398,FIGUEIRA,25230570,58335,ALAMEDA PAULA LILIANE S/N,"ALAMEDA PAULA LILIANE S/N, FIGUEIRA, DUQUE DE CAXIAS, Rio de Janeiro",117,ESCOLA  MUNICIPAL IMACULADA CONCEICAO,DUQUE DE CAXIAS,1511,0.18,0.0,0.03,0.0,0.71,0.09,289,0,10,0,281,36,126
89,160,100,394,DOUTOR LAUREANO,25050580,58335,AV. CHOPIN S/N,"AV. CHOPIN S/N, DOUTOR LAUREANO, DUQUE DE CAXIAS, Rio de Janeiro",145,CIEP CHARLES CHAPLIN,DUQUE DE CAXIAS,1295,0.25,0.0,0.03,0.0,0.63,0.08,164,0,13,0,249,32,78
68,180,100,390,VILA EMA,25268000,58335,"RUA M, SN","RUA M, SN, VILA EMA, DUQUE DE CAXIAS, Rio de Janeiro",142,ESCOLA ESTADUAL FRANCISCO PORTUGAL NEVES,DUQUE DE CAXIAS,1040,0.26,0.0,0.03,0.0,0.64,0.08,19,0,11,0,248,31,127
153,115,99,397,VILA ROSARIO,25040060,58335,AVENIDA PRESIDENTE KENNEDY S/N,"AVENIDA PRESIDENTE KENNEDY S/N, VILA ROSARIO, DUQUE DE CAXIAS, Rio de Janeiro",129,ESCOLA MUNICIPAL JOSE CAMILO DOS SANTOS,DUQUE DE CAXIAS,2194,0.25,0.0,0.02,0.0,0.68,0.06,602,0,8,0,268,22,79
94,108,53,286,COPACABANA,25060200,58335,RUA PRESIDENTE JUSCELINO KUBISTCHEK DE OLIVEIRA 4160,"RUA PRESIDENTE JUSCELINO KUBISTCHEK DE OLIVEIRA 4160, COPACABANA, DUQUE DE CAXIAS, Rio de Janeiro",84,ESCOLA ESTADUAL GENERAL TIBÚRCIO,DUQUE DE CAXIAS,1023,0.19,0.0,0.02,0.0,0.71,0.09,114,0,6,0,202,25,78
89,129,121,389,NOVA CAMPINAS,25265000,58335,"AV. A, S/N","AV. A, S/N, NOVA CAMPINAS, DUQUE DE CAXIAS, Rio de Janeiro",171,CIEP 476 - ELIAS LAZARONI,DUQUE DE CAXIAS,1287,0.31,0.0,0.04,0.0,0.56,0.09,73,0,16,0,218,34,127
58,129,62,290,SANTA CRUZ DA SERRA,25240000,58335,"RUA 20, LOTE 12, QUADRA 23","RUA 20, LOTE 12, QUADRA 23, SANTA CRUZ DA SERRA, DUQUE DE CAXIAS, Rio de Janeiro",103,ESCOLA MUNICIPAL PEDRO PAULO DA SILVA,DUQUE DE CAXIAS,1252,0.21,0.0,0.04,0.0,0.64,0.1,157,0,13,0,187,28,128
93,103,89,323,PARQUE SENHOR DO BONFIM,25000000,58335,AV. SALGADO FILHO 434,"AV. SALGADO FILHO 434, PARQUE SENHOR DO BONFIM, DUQUE DE CAXIAS, Rio de Janeiro",127,ESCOLA MUNICIPAL ZILLA JUNGER,DUQUE DE CAXIAS,1309,0.28,0.0,0.02,0.0,0.61,0.09,95,0,8,0,196,30,103
81,163,83,395,PARQUE EQUITATIVA,25260000,58335,"RUA MARQUES DE LAFAIETE, 70","RUA MARQUES DE LAFAIETE, 70, PARQUE EQUITATIVA, DUQUE DE CAXIAS, Rio de Janeiro",151,ESCOLA MUNICIPAL SANTA LUZIA,DUQUE DE CAXIAS,1414,0.21,0.0,0.05,0.0,0.62,0.12,183,0,21,0,244,47,127
