DICA,WASHINGTON REIS,abstencoes,aptos,bairro,cep,codigo_municipio,endereco,location,nao_considerados,nome_local,nome_munic,num_local,percentual_abstencoes,percentual_anulados,percentual_brancos,percentual_legenda,percentual_nominais,percentual_nulos,secao,votos_anulados,votos_brancos,votos_legenda,votos_nominais,votos_nulos,zona
91,129,97,395,JARDIM PRIMAVERA,25215255,58335,AV. EMILIO DE MENEZES S/N,"AV. EMILIO DE MENEZES S/N, JARDIM PRIMAVERA, DUQUE DE CAXIAS, Rio de Janeiro",175,CIEP 369 JORNALISTA SANDRO MOREYRA,DUQUE DE CAXIAS,1104,0.25,0.0,0.03,0.0,0.56,0.16,345,0,13,0,220,65,126
49,99,99,281,PARQUE PAULISTA,25261320,58335,"AVENIDA 31 DE MARÇO, S/N","AVENIDA 31 DE MARÇO, S/N, PARQUE PAULISTA, DUQUE DE CAXIAS, Rio de Janeiro",133,ESCOLA ESTADUAL PADRE ANCHIETA,DUQUE DE CAXIAS,1112,0.35,0.0,0.04,0.0,0.53,0.09,67,0,10,0,148,24,127
118,102,62,312,VILA SÃO LUIS,25065090,58335,RUA EXPEDICIONARIO JOSE AMARO 305,"RUA EXPEDICIONARIO JOSE AMARO 305, VILA SÃO LUIS, DUQUE DE CAXIAS, Rio de Janeiro",92,EDUCANDÁRIO SANTA CECÍLIA,DUQUE DE CAXIAS,1210,0.2,0.0,0.03,0.0,0.71,0.07,152,0,8,0,220,22,78
75,168,76,358,JARDIM ANHANGÁ,25264350,58335,"AV. ANHANGÁ, S/N","AV. ANHANGÁ, S/N, JARDIM ANHANGÁ, DUQUE DE CAXIAS, Rio de Janeiro",115,CIEP 319 - ODUVALDO VIANA FILHO,DUQUE DE CAXIAS,1244,0.21,0.0,0.04,0.0,0.68,0.07,97,0,13,0,243,26,127
121,97,73,343,VILA SÃO LUIS,25065050,58335,RUA GENERAL MANOEL RABELO S/N,"RUA GENERAL MANOEL RABELO S/N, VILA SÃO LUIS, DUQUE DE CAXIAS, Rio de Janeiro",125,FACULDADE DE EDUCACAO DA BAIXADA FLUMINENSE - UERJ,DUQUE DE CAXIAS,1155,0.21,0.0,0.01,0.0,0.64,0.14,102,0,5,0,218,47,200
136,110,77,384,BANANAL,25035030,58335,AV. FRANCISCO FALEIRO DE FREITAS LIMA 194,"AV. FRANCISCO FALEIRO DE FREITAS LIMA 194, BANANAL, DUQUE DE CAXIAS, Rio de Janeiro",138,ESCOLA ESTADUAL GETULIO VARGAS,DUQUE DE CAXIAS,1015,0.2,0.0,0.05,0.0,0.64,0.11,114,0,20,0,246,41,194
100,121,66,342,SARACURUNA,25220010,58335,RUA CORONEL CARLOS MATOS QD 3 LT. 22,"RUA CORONEL CARLOS MATOS QD 3 LT. 22, SARACURUNA, DUQUE DE CAXIAS, Rio de Janeiro",121,ESCOLA ESTADUAL VERA LÚCIA TAVARES ROMÃO,DUQUE DE CAXIAS,1465,0.19,0.0,0.01,0.0,0.65,0.15,305,0,5,0,221,50,126
142,120,90,394,PANTANAL,25040060,58335,AV. LAURO SODRE S/N,"AV. LAURO SODRE S/N, PANTANAL, DUQUE DE CAXIAS, Rio de Janeiro",132,CIEP GRACILIANO RAMOS,DUQUE DE CAXIAS,1376,0.23,0.0,0.02,0.0,0.66,0.09,559,0,6,0,262,36,79
116,114,87,371,CENTENÁRIO,25020210,58335,RUA MANOEL VIEIRA S/N,"RUA MANOEL VIEIRA S/N, CENTENÁRIO, DUQUE DE CAXIAS, Rio de Janeiro",141,ESCOLA MUNICIPAL CARLOTA MACHADO,DUQUE DE CAXIAS,1384,0.23,0.0,0.04,0.0,0.62,0.11,140,0,15,0,230,39,77
47,237,43,356,MANTIQUIRA,25250570,58335,"RUA DR. OSMUNDO RIBEIRO DUARTE, S/N","RUA DR. OSMUNDO RIBEIRO DUARTE, S/N, MANTIQUIRA, DUQUE DE CAXIAS, Rio de Janeiro",72,ESCOLA MUNICIPAL SANTO AGOSTINHO,DUQUE DE CAXIAS,1155,0.12,0.0,0.01,0.0,0.8,0.07,80,0,4,0,284,25,128
102,88,98,313,SANTA TERESA,25086030,58335,"ESTRADA SÃO VICENTE, 98","ESTRADA SÃO VICENTE, 98, SANTA TERESA, DUQUE DE CAXIAS, Rio de Janeiro",123,CIEP 098 PROFESSORA HILDA DO CARMO SIQUEIRA,DUQUE DE CAXIAS,1015,0.31,0.0,0.01,0.0,0.61,0.07,1,0,4,0,190,21,200
55,197,105,398,FIGUEIRA,25230020,58335,AV. DEMETRIO RIBEIRO S/N,"AV. DEMETRIO RIBEIRO S/N, FIGUEIRA, DUQUE DE CAXIAS, Rio de Janeiro",146,COLEGIO ESTADUAL FREI HENRIQUE DE COIMBRA,DUQUE DE CAXIAS,1414,0.26,0.0,0.02,0.0,0.63,0.09,199,0,7,0,252,34,126
110,85,75,323,PARQUE SENHOR DO BONFIM,25000000,58335,AV. SALGADO FILHO 434,"AV. SALGADO FILHO 434, PARQUE SENHOR DO BONFIM, DUQUE DE CAXIAS, Rio de Janeiro",128,ESCOLA MUNICIPAL ZILLA JUNGER,DUQUE DE CAXIAS,1309,0.23,0.0,0.04,0.0,0.6,0.12,108,0,13,0,195,40,103
81,165,89,381,SARACURUNA,25220650,58335,RUA PEDRO I S/N,"RUA PEDRO I S/N, SARACURUNA, DUQUE DE CAXIAS, Rio de Janeiro",135,ESCOLA MUNICIPAL PEDRO RODRIGUES DO CARMO,DUQUE DE CAXIAS,1570,0.23,0.0,0.04,0.0,0.65,0.08,275,0,14,0,246,32,126
141,105,84,398,JARDIM PRIMAVERA,25223230,58335,RUA AMILCAR MARAPANIM S/N,"RUA AMILCAR MARAPANIM S/N, JARDIM PRIMAVERA, DUQUE DE CAXIAS, Rio de Janeiro",152,CIEP 208 ALCEU AMOROSO LIMA,DUQUE DE CAXIAS,1090,0.21,0.0,0.06,0.0,0.62,0.11,291,0,24,0,246,44,126
61,213,66,382,XERÉM,25250080,58335,"RUA RIO GRANDE DO SUL, N 17","RUA RIO GRANDE DO SUL, N 17, XERÉM, DUQUE DE CAXIAS, Rio de Janeiro",108,ESCOLA MINICIPAL DOUTOR ELY COMBAT,DUQUE DE CAXIAS,1104,0.17,0.0,0.02,0.0,0.72,0.09,43,0,6,0,274,36,128
53,205,106,384,XERÉM,25250080,58335,"RUA RIO GRANDE DO SUL, N 17","RUA RIO GRANDE DO SUL, N 17, XERÉM, DUQUE DE CAXIAS, Rio de Janeiro",126,ESCOLA MINICIPAL DOUTOR ELY COMBAT,DUQUE DE CAXIAS,1104,0.28,0.0,0.01,0.0,0.67,0.04,39,0,4,0,258,16,128
42,226,84,376,XERÉM,25245410,58335,RUA ENEAS FRUTUOSO S/N,"RUA ENEAS FRUTUOSO S/N, XERÉM, DUQUE DE CAXIAS, Rio de Janeiro",108,CIEP 338 - CELIA RABELO,DUQUE DE CAXIAS,1244,0.22,0.0,0.02,0.0,0.71,0.05,156,0,6,0,268,18,128
93,53,92,269,VILA SÃO LUIS,25065030,58335,"RUA DOUTOR CARLOS ESTEVES, 216","RUA DOUTOR CARLOS ESTEVES, 216, VILA SÃO LUIS, DUQUE DE CAXIAS, Rio de Janeiro",123,CENTRO EDUCACIONAL BERBERT BARROS,DUQUE DE CAXIAS,1392,0.34,0.0,0.01,0.0,0.54,0.1,57,0,3,0,146,28,200
40,148,86,289,CAPIVARI,25245230,58335,AV. MARQUES DE BARBACENA LT 18/19 QD 3,"AV. MARQUES DE BARBACENA LT 18/19 QD 3, CAPIVARI, DUQUE DE CAXIAS, Rio de Janeiro",101,ESCOLA MUNICIPAL PARQUE CAPIVARI,DUQUE DE CAXIAS,1503,0.3,0.0,0.01,0.0,0.65,0.04,245,0,3,0,188,12,126
73,113,61,282,IMBARIÊ,25266250,58335,"AV. CORONEL SISSON, S/N","AV. CORONEL SISSON, S/N, IMBARIÊ, DUQUE DE CAXIAS, Rio de Janeiro",96,ESCOLA MUNICIPAL PROFESSORA CARMEM CORREA DE CARVALHO REIS BRÁZ,DUQUE DE CAXIAS,1198,0.22,0.0,0.03,0.0,0.66,0.09,106,0,9,0,186,26,127
92,91,77,306,VILA SÃO LUIS,25065090,58335,RUA EXPEDICIONARIO JOSE AMARO 305,"RUA EXPEDICIONARIO JOSE AMARO 305, VILA SÃO LUIS, DUQUE DE CAXIAS, Rio de Janeiro",123,EDUCANDÁRIO SANTA CECÍLIA,DUQUE DE CAXIAS,1210,0.25,0.0,0.03,0.0,0.6,0.12,117,0,9,0,183,37,78
89,90,44,265,GRAMACHO,25035185,58335,"RUA JOAQUIM JOSE SOARES, N 273","RUA JOAQUIM JOSE SOARES, N 273, GRAMACHO, DUQUE DE CAXIAS, Rio de Janeiro",86,CENSA -  CENTRO EDUCACIONAL DE CAXIAS NOSSA SRA APARECIDA,DUQUE DE CAXIAS,1287,0.17,0.0,0.02,0.0,0.68,0.14,38,0,6,0,179,36,194
131,109,114,394,PERIQUITOS,25025320,58335,"RUA BERNARDO MONTEIRO, 13","RUA BERNARDO MONTEIRO, 13, PERIQUITOS, DUQUE DE CAXIAS, Rio de Janeiro",154,ESCOLA ESTADUAL INÁCIO BEZERRA DE MENEZES,DUQUE DE CAXIAS,1252,0.29,0.0,0.02,0.0,0.61,0.08,107,0,8,0,240,32,77
83,183,74,392,VILA EMA,25268000,58335,"RUA M, SN","RUA M, SN, VILA EMA, DUQUE DE CAXIAS, Rio de Janeiro",126,ESCOLA ESTADUAL FRANCISCO PORTUGAL NEVES,DUQUE DE CAXIAS,1040,0.19,0.0,0.03,0.0,0.68,0.1,21,0,12,0,266,40,127
130,80,131,396,JARDIM 25 DE AGOSTO,25071202,58335,"RUA PROF. JOSÉ DE SOUZA HERDY, 1160","RUA PROF. JOSÉ DE SOUZA HERDY, 1160, JARDIM 25 DE AGOSTO, DUQUE DE CAXIAS, Rio de Janeiro",186,UNIGRANRIO,DUQUE DE CAXIAS,1015,0.33,0.0,0.02,0.0,0.53,0.12,40,0,6,0,210,49,66
94,165,90,397,IMBARIÊ,25000000,58335,"RUA GOINDIRA, 379","RUA GOINDIRA, 379, IMBARIÊ, DUQUE DE CAXIAS, Rio de Janeiro",138,COLÉGIO ESTADUAL FERNANDO FIGUEIREDO,DUQUE DE CAXIAS,1031,0.23,0.0,0.03,0.0,0.65,0.09,9,0,12,0,259,36,127
67,177,107,398,FIGUEIRA,25230020,58335,AV. DEMETRIO RIBEIRO S/N,"AV. DEMETRIO RIBEIRO S/N, FIGUEIRA, DUQUE DE CAXIAS, Rio de Janeiro",154,COLEGIO ESTADUAL FREI HENRIQUE DE COIMBRA,DUQUE DE CAXIAS,1414,0.27,0.0,0.04,0.0,0.61,0.08,203,0,15,0,244,32,126
55,59,80,215,CENTRO,25020150,58335,"RUA JOSE DE ALVARENGA, 642","RUA JOSE DE ALVARENGA, 642, CENTRO, DUQUE DE CAXIAS, Rio de Janeiro",101,IPMDC-INSTITUTO DE PREVIDENCIA MUNICIPAL DE DUQUE DE CAXIAS,DUQUE DE CAXIAS,1171,0.37,0.0,0.02,0.0,0.53,0.08,54,0,4,0,114,17,103
102,113,112,386,SARACURUNA,25220010,58335,RUA CORONEL CARLOS MATOS QD 3 LT. 22,"RUA CORONEL CARLOS MATOS QD 3 LT. 22, SARACURUNA, DUQUE DE CAXIAS, Rio de Janeiro",171,ESCOLA ESTADUAL VERA LÚCIA TAVARES ROMÃO,DUQUE DE CAXIAS,1465,0.29,0.0,0.03,0.0,0.56,0.12,225,0,13,0,215,46,126
143,103,83,392,SÃO BENTO,25045000,58335,AV. PRESIDENTE KENNEDY S/N,"AV. PRESIDENTE KENNEDY S/N, SÃO BENTO, DUQUE DE CAXIAS, Rio de Janeiro",146,CIEP 118 VEREADOR VILSON CAMPOS MACEDO,DUQUE DE CAXIAS,1783,0.21,0.0,0.04,0.0,0.63,0.12,525,0,16,0,246,47,79
125,145,63,397,JARDIM PRIMAVERA,25223540,58335,PRACA NOSSA SENHORA DE LOURDES S/N,"PRACA NOSSA SENHORA DE LOURDES S/N, JARDIM PRIMAVERA, DUQUE DE CAXIAS, Rio de Janeiro",127,CIEP 209 ATAULPHO ALVES,DUQUE DE CAXIAS,1120,0.16,0.0,0.03,0.0,0.68,0.13,86,0,11,0,270,53,126
135,105,108,395,PANTANAL,25040060,58335,AV. LAURO SODRE S/N,"AV. LAURO SODRE S/N, PANTANAL, DUQUE DE CAXIAS, Rio de Janeiro",155,CIEP GRACILIANO RAMOS,DUQUE DE CAXIAS,1376,0.27,0.0,0.04,0.0,0.61,0.08,171,0,16,0,240,31,79
74,180,62,380,PARQUE ELDORADO,11111111,58335,RUA PARANA 5 E 6,"RUA PARANA 5 E 6, PARQUE ELDORADO, DUQUE DE CAXIAS, Rio de Janeiro",126,CENTRO EDUCACIONAL RENASCER,DUQUE DE CAXIAS,1058,0.16,0.0,0.03,0.0,0.67,0.14,19,0,11,0,254,53,128
63,152,52,321,JARDIM ANHANGÁ,25264350,58335,"AV. ANHANGÁ, S/N","AV. ANHANGÁ, S/N, JARDIM ANHANGÁ, DUQUE DE CAXIAS, Rio de Janeiro",106,CIEP 319 - ODUVALDO VIANA FILHO,DUQUE DE CAXIAS,1244,0.16,0.0,0.04,0.0,0.67,0.12,134,0,14,0,215,40,127
79,165,112,397,JARDIM GRAMACHO,25055120,58335,RUA AVARE 19,"RUA AVARE 19, JARDIM GRAMACHO, DUQUE DE CAXIAS, Rio de Janeiro",153,ESCOLA ESTADUAL LARA VILELA,DUQUE DE CAXIAS,1147,0.28,0.0,0.02,0.0,0.61,0.08,63,0,9,0,244,32,78
120,132,59,352,CENTENÁRIO,25080460,58335,RUA DA MINA 960,"RUA DA MINA 960, CENTENÁRIO, DUQUE DE CAXIAS, Rio de Janeiro",100,ESCOLA ESTADUAL SENHOR DO BONFIM,DUQUE DE CAXIAS,1066,0.17,0.0,0.02,0.0,0.72,0.1,178,0,7,0,252,34,77
165,89,93,387,SANTA LÚCIA,25275450,58335,"AV. FELICIANO SODRÉ, S/N","AV. FELICIANO SODRÉ, S/N, SANTA LÚCIA, DUQUE DE CAXIAS, Rio de Janeiro",133,CIEP 171 - JOSÉ AMÉRICO PESSANHA,DUQUE DE CAXIAS,1015,0.24,0.0,0.03,0.0,0.66,0.07,177,0,13,0,254,27,127
127,112,78,388,BANANAL,25035030,58335,AV. FRANCISCO FALEIRO DE FREITAS LIMA 194,"AV. FRANCISCO FALEIRO DE FREITAS LIMA 194, BANANAL, DUQUE DE CAXIAS, Rio de Janeiro",149,ESCOLA ESTADUAL GETULIO VARGAS,DUQUE DE CAXIAS,1015,0.2,0.0,0.04,0.0,0.62,0.14,5,0,17,0,239,54,194
65,126,80,319,PARQUE EQUITATIVA,25260000,58335,"RUA MARQUES DE LAFAIETE, 70","RUA MARQUES DE LAFAIETE, 70, PARQUE EQUITATIVA, DUQUE DE CAXIAS, Rio de Janeiro",128,ESCOLA MUNICIPAL SANTA LUZIA,DUQUE DE CAXIAS,1414,0.25,0.0,0.04,0.0,0.6,0.11,174,0,14,0,191,34,127
151,98,114,399,BEIRA MAR,25085485,58335,RUA FELISBERTO FREIRE S/N,"RUA FELISBERTO FREIRE S/N, BEIRA MAR, DUQUE DE CAXIAS, Rio de Janeiro",150,ESCOLA MUNICIPAL JOAQUIM DA SILVA PEÇANHA,DUQUE DE CAXIAS,1325,0.29,0.0,0.03,0.0,0.62,0.06,14,0,11,0,249,25,66
127,106,95,378,CENTRO,25020210,58335,RUA MANOEL VIEIRA 397,"RUA MANOEL VIEIRA 397, CENTRO, DUQUE DE CAXIAS, Rio de Janeiro",145,CLUBE RECREATIVO CAXIENSE,DUQUE DE CAXIAS,1090,0.25,0.0,0.02,0.0,0.62,0.11,31,0,8,0,233,42,103
68,118,78,295,PARADA ANGÉLICA,25272230,58335,"RUA REAL DA ESTRELA, S/N","RUA REAL DA ESTRELA, S/N, PARADA ANGÉLICA, DUQUE DE CAXIAS, Rio de Janeiro",109,CIEP 407 - NEUZA GOULART BRIZOLA,DUQUE DE CAXIAS,1074,0.26,0.0,0.03,0.0,0.63,0.08,40,0,8,0,186,23,127
124,75,136,375,CENTRO,25010000,58335,AV. PRESIDENTE KENNEDY 514,"AV. PRESIDENTE KENNEDY 514, CENTRO, DUQUE DE CAXIAS, Rio de Janeiro",176,COLEGIO FUTURO VIP (ANTIGO CURSO GPI),DUQUE DE CAXIAS,1058,0.36,0.0,0.04,0.0,0.53,0.07,22,0,14,0,199,26,103
72,91,40,239,GRAMACHO,25035250,58335,AV. DARCY VARGAS 21,"AV. DARCY VARGAS 21, GRAMACHO, DUQUE DE CAXIAS, Rio de Janeiro",76,ESCOLA MUNICIPAL CORA CORALINA (ANTIGA THIAGO APOSTOLO),DUQUE DE CAXIAS,1120,0.17,0.0,0.04,0.0,0.68,0.11,74,0,9,0,163,27,194
83,56,54,230,SÃO BENTO,25045010,58335,AV. PRES. KENNEDY 9422,"AV. PRES. KENNEDY 9422, SÃO BENTO, DUQUE DE CAXIAS, Rio de Janeiro",91,FEUDUC,DUQUE DE CAXIAS,1244,0.23,0.0,0.04,0.0,0.6,0.12,399,0,9,0,139,28,79
169,113,69,397,SÃO BENTO,25045010,58335,AV. PRESIDENTE KENNEDY 9422,"AV. PRESIDENTE KENNEDY 9422, SÃO BENTO, DUQUE DE CAXIAS, Rio de Janeiro",115,FEUDUC,DUQUE DE CAXIAS,1252,0.17,0.0,0.03,0.0,0.71,0.09,357,0,11,0,282,35,79
185,95,91,396,PARQUE FELICIDADE,25080570,58335,"RUA BARBOSA ARAÚJO, 265","RUA BARBOSA ARAÚJO, 265, PARQUE FELICIDADE, DUQUE DE CAXIAS, Rio de Janeiro",116,ESCOLA MUNICIPAL ONERES NUNES DE OLIVEIRA - ANTIGO COLEGIO FLUMINENSE,DUQUE DE CAXIAS,1228,0.23,0.0,0.01,0.0,0.71,0.06,90,0,2,0,280,23,66
124,122,78,370,PARQUE COMERCIAL,25041700,58335,RUA ANTONIO GONCALVES MARTINS QD 7 LT 18,"RUA ANTONIO GONCALVES MARTINS QD 7 LT 18, PARQUE COMERCIAL, DUQUE DE CAXIAS, Rio de Janeiro",124,ESCOLA MUNICIPAL CORONEL ELISEU,DUQUE DE CAXIAS,1775,0.21,0.0,0.02,0.0,0.66,0.11,567,0,7,0,246,39,79
138,105,77,375,COPACABANA,25060250,58335,RUA TOMAS ANTONIO GONZAGA 1845,"RUA TOMAS ANTONIO GONZAGA 1845, COPACABANA, DUQUE DE CAXIAS, Rio de Janeiro",132,ESCOLA ESTADUAL ZUMBI DOS PALMARES,DUQUE DE CAXIAS,1279,0.21,0.0,0.03,0.0,0.65,0.12,191,0,10,0,243,45,78
94,165,60,395,IMBARIÊ,25000000,58335,"RUA GOINDIRA, 379","RUA GOINDIRA, 379, IMBARIÊ, DUQUE DE CAXIAS, Rio de Janeiro",136,COLÉGIO ESTADUAL FERNANDO FIGUEIREDO,DUQUE DE CAXIAS,1031,0.15,0.0,0.05,0.0,0.66,0.14,16,0,20,0,259,56,127
135,85,127,397,JARDIM PRIMAVERA,25212360,58335,RUA SANTA RITA S/N,"RUA SANTA RITA S/N, JARDIM PRIMAVERA, DUQUE DE CAXIAS, Rio de Janeiro",177,ESCOLA ESTADUAL ALEXANDER GRAHAM BELL,DUQUE DE CAXIAS,1112,0.32,0.0,0.04,0.0,0.55,0.08,75,0,17,0,220,33,126
60,199,95,373,XERÉM,25250310,58335,ESTRADA DA IGREJA VELHA-F.N.M. S/N,"ESTRADA DA IGREJA VELHA-F.N.M. S/N, XERÉM, DUQUE DE CAXIAS, Rio de Janeiro",114,ESCOLA ESTADUAL SANTO ANTONIO,DUQUE DE CAXIAS,1090,0.25,0.0,0.01,0.0,0.69,0.04,34,0,4,0,259,15,128
123,64,48,255,BAR DOS CAVALEIROS,25015420,58335,RUA CAMPOS 55,"RUA CAMPOS 55, BAR DOS CAVALEIROS, DUQUE DE CAXIAS, Rio de Janeiro",68,ESCOLA MUNICIPAL PROF. HILDA DO CARMO SIQUEIRA,DUQUE DE CAXIAS,1384,0.19,0.0,0.01,0.0,0.73,0.07,203,0,3,0,187,17,103
132,113,105,384,JARDIM LEAL,25035610,58335,RUA FRANCISCA LEAL S/N  (ANTIGA RUA PORTUGAL),"RUA FRANCISCA LEAL S/N  (ANTIGA RUA PORTUGAL), JARDIM LEAL, DUQUE DE CAXIAS, Rio de Janeiro",139,ESCOLA ESTADUAL FIDELIS MEDEIROS,DUQUE DE CAXIAS,1090,0.27,0.0,0.03,0.0,0.64,0.06,47,0,11,0,245,23,194
69,62,61,214,CENTRO,25020150,58335,"RUA JOSE DE ALVARENGA, 642","RUA JOSE DE ALVARENGA, 642, CENTRO, DUQUE DE CAXIAS, Rio de Janeiro",83,IPMDC-INSTITUTO DE PREVIDENCIA MUNICIPAL DE DUQUE DE CAXIAS,DUQUE DE CAXIAS,1171,0.29,0.0,0.03,0.0,0.61,0.07,139,0,6,0,131,16,103
105,134,124,398,PILAR,25233090,58335,"RUA LEONTINA MEZIOT, S/N","RUA LEONTINA MEZIOT, S/N, PILAR, DUQUE DE CAXIAS, Rio de Janeiro",159,CIEP 404 - CLARICE LISPECTOR,DUQUE DE CAXIAS,1082,0.31,0.0,0.03,0.0,0.6,0.06,38,0,12,0,239,23,79
141,111,84,389,SANTA LÚCIA,25275450,58335,"AV. FELICIANO SODRÉ, S/N","AV. FELICIANO SODRÉ, S/N, SANTA LÚCIA, DUQUE DE CAXIAS, Rio de Janeiro",137,CIEP 171 - JOSÉ AMÉRICO PESSANHA,DUQUE DE CAXIAS,1015,0.22,0.0,0.05,0.0,0.65,0.08,139,0,21,0,252,32,127
106,125,104,369,CENTENÁRIO,25020210,58335,RUA MANOEL VIEIRA S/N,"RUA MANOEL VIEIRA S/N, CENTENÁRIO, DUQUE DE CAXIAS, Rio de Janeiro",138,CRECHE MUNICIPAL PROFESSOR JOÃO DE OLIVEIRA,DUQUE DE CAXIAS,1090,0.28,0.0,0.03,0.0,0.63,0.06,39,0,11,0,231,23,77
78,149,84,368,IMBARIÊ,25275300,58335,"RUA 14 DE JULHO, LT 13 QD 67","RUA 14 DE JULHO, LT 13 QD 67, IMBARIÊ, DUQUE DE CAXIAS, Rio de Janeiro",141,ESCOLA MUNICIPAL PAULO RODRIGUES PEREIRA,DUQUE DE CAXIAS,1180,0.23,0.0,0.04,0.0,0.62,0.12,102,0,14,0,227,43,127
127,139,80,396,CAMPOS ELÍSEOS,25225216,58335,AV. TUPINAMBA DE CASTRO S/N,"AV. TUPINAMBA DE CASTRO S/N, CAMPOS ELÍSEOS, DUQUE DE CAXIAS, Rio de Janeiro",130,ESCOLA ESTADUAL ADELINA CASTRO,DUQUE DE CAXIAS,1023,0.2,0.0,0.03,0.0,0.67,0.1,15,0,10,0,266,40,126
145,99,96,396,VILA ROSARIO,25040060,58335,AVENIDA PRESIDENTE KENNEDY S/N,"AVENIDA PRESIDENTE KENNEDY S/N, VILA ROSARIO, DUQUE DE CAXIAS, Rio de Janeiro",152,ESCOLA MUNICIPAL JOSE CAMILO DOS SANTOS,DUQUE DE CAXIAS,2194,0.24,0.0,0.04,0.0,0.62,0.1,646,0,16,0,244,40,79
85,164,83,382,SARACURUNA,25220650,58335,RUA PEDRO I S/N,"RUA PEDRO I S/N, SARACURUNA, DUQUE DE CAXIAS, Rio de Janeiro",133,ESCOLA MUNICIPAL PEDRO RODRIGUES DO CARMO,DUQUE DE CAXIAS,1570,0.22,0.0,0.03,0.0,0.65,0.1,318,0,11,0,249,39,126
145,107,74,357,CORTE OITO,25030020,58335,RUA VASSOURAS 154,"RUA VASSOURAS 154, CORTE OITO, DUQUE DE CAXIAS, Rio de Janeiro",105,CENTRO DE FORMAÇÃO EDUCACIONAL JEAN PIAGET,DUQUE DE CAXIAS,1139,0.21,0.0,0.02,0.0,0.71,0.06,52,0,8,0,252,23,77
141,110,81,385,PANTANAL,25040160,58335,AV. GOMES FREIRE S/N,"AV. GOMES FREIRE S/N, PANTANAL, DUQUE DE CAXIAS, Rio de Janeiro",134,CIEP CLEMENTINA DE JESUS,DUQUE DE CAXIAS,1805,0.21,0.0,0.05,0.0,0.65,0.09,505,0,19,0,251,34,79
63,183,79,397,FRANGO DOURADO,25251130,58335,RUA BOITATA S/N,"RUA BOITATA S/N, FRANGO DOURADO, DUQUE DE CAXIAS, Rio de Janeiro",151,CIEP 320 - ARCAMPO,DUQUE DE CAXIAS,1015,0.2,0.0,0.04,0.0,0.62,0.14,100,0,16,0,246,56,128
112,120,84,363,CENTENÁRIO,25030040,58335,RUA DR. OTAVIO ASCOLI S/N,"RUA DR. OTAVIO ASCOLI S/N, CENTENÁRIO, DUQUE DE CAXIAS, Rio de Janeiro",131,ESCOLA MUNICIPAL HERMÍNIA CALDAS DA SILVA,DUQUE DE CAXIAS,1104,0.23,0.0,0.04,0.0,0.64,0.09,115,0,13,0,232,34,77
137,71,96,335,SÃO BENTO,25045000,58335,AV. PRESIDENTE KENNEDY S/N,"AV. PRESIDENTE KENNEDY S/N, SÃO BENTO, DUQUE DE CAXIAS, Rio de Janeiro",127,CIEP 201 AARAO STEINBRUCH,DUQUE DE CAXIAS,1910,0.29,0.0,0.02,0.0,0.62,0.07,94,0,8,0,208,23,79
87,147,90,382,SARAPUÍ,25050040,58335,RUA ALEX LUNDGREN 21/22,"RUA ALEX LUNDGREN 21/22, SARAPUÍ, DUQUE DE CAXIAS, Rio de Janeiro",148,COLÉGIO SÃO MIGUEL ARCANJO,DUQUE DE CAXIAS,1236,0.24,0.0,0.03,0.0,0.61,0.12,180,0,12,0,234,46,78
74,163,77,372,IMBARIÊ,25267000,58335,"RUA GOINDIRA, S/N","RUA GOINDIRA, S/N, IMBARIÊ, DUQUE DE CAXIAS, Rio de Janeiro",135,COLÉGIO ESTADUAL DOUTOR ALFREDO BACKER,DUQUE DE CAXIAS,1023,0.21,0.0,0.03,0.0,0.64,0.13,210,0,10,0,237,48,127
101,100,50,292,DOUTOR LAUREANO,25060220,58335,RUA LAURINDO RABELO S/N,"RUA LAURINDO RABELO S/N, DOUTOR LAUREANO, DUQUE DE CAXIAS, Rio de Janeiro",91,ESCOLA MUNICIPAL SERGIPE,DUQUE DE CAXIAS,1066,0.17,0.0,0.02,0.0,0.69,0.12,167,0,7,0,201,34,78
142,79,131,377,CENTRO,25010000,58335,AV. PRESIDENTE KENNEDY 514,"AV. PRESIDENTE KENNEDY 514, CENTRO, DUQUE DE CAXIAS, Rio de Janeiro",156,COLEGIO FUTURO VIP (ANTIGO CURSO GPI),DUQUE DE CAXIAS,1058,0.35,0.0,0.02,0.0,0.59,0.05,25,0,7,0,221,18,103
60,192,60,368,PARQUE ELDORADO,25250080,58335,RUA RIO GRANDE DO SUL S/N,"RUA RIO GRANDE DO SUL S/N, PARQUE ELDORADO, DUQUE DE CAXIAS, Rio de Janeiro",116,ESCOLA ESTADUAL MARECHAL RONDON,DUQUE DE CAXIAS,1023,0.16,0.0,0.03,0.0,0.68,0.12,6,0,10,0,252,46,128
68,76,85,253,ITATIAIA,25070000,58335,RUA ALBERTO TORRES 155,"RUA ALBERTO TORRES 155, ITATIAIA, DUQUE DE CAXIAS, Rio de Janeiro",109,FUNDAÇÃO DE APOIO À ESCOLA TÉCNICA - FAETEC,DUQUE DE CAXIAS,1074,0.34,0.0,0.02,0.0,0.57,0.07,44,0,6,0,144,18,200
87,54,85,245,ENGENHO DO PORTO,25015190,58335,RUA COMANDANTE ARI PARREIRAS S/N,"RUA COMANDANTE ARI PARREIRAS S/N, ENGENHO DO PORTO, DUQUE DE CAXIAS, Rio de Janeiro",104,CIEP ANTONIETA CAMPOS DA PAZ (CIEP 434-MARIA JOSE MACHADO),DUQUE DE CAXIAS,1368,0.35,0.0,0.01,0.0,0.58,0.07,188,0,2,0,141,17,103
64,104,101,291,VILA CANAAN,25255160,58335,RUA BONSUCESSO S/N,"RUA BONSUCESSO S/N, VILA CANAAN, DUQUE DE CAXIAS, Rio de Janeiro",123,ESCOLA ESTADUAL ALEMY TAVARES DA SILVA,DUQUE DE CAXIAS,1139,0.35,0.0,0.01,0.0,0.58,0.07,61,0,3,0,168,19,128
132,65,92,340,CENTRO,25010300,58335,RUA TENENTE JOSE DIAS 349,"RUA TENENTE JOSE DIAS 349, CENTRO, DUQUE DE CAXIAS, Rio de Janeiro",143,COLEGIO SANTO ANTONIO,DUQUE DE CAXIAS,1120,0.27,0.0,0.03,0.0,0.58,0.12,136,0,9,0,197,42,103
122,133,80,396,SARACURUNA,25212662,58335,RUA CASTRO ALVES S/N,"RUA CASTRO ALVES S/N, SARACURUNA, DUQUE DE CAXIAS, Rio de Janeiro",141,CIEP 229 CANDIDO PORTINARI,DUQUE DE CAXIAS,1724,0.2,0.0,0.04,0.0,0.64,0.11,234,0,17,0,255,44,126
159,94,76,384,PARQUE FLUMINENSE,25045270,58335,RUA JOSE DE AZEVEDO 156,"RUA JOSE DE AZEVEDO 156, PARQUE FLUMINENSE, DUQUE DE CAXIAS, Rio de Janeiro",131,ESCOLA MUNICIPAL PAULO FREIRE,DUQUE DE CAXIAS,1180,0.2,0.0,0.04,0.0,0.66,0.1,557,0,16,0,253,39,79
124,51,81,276,BAR DOS CAVALEIROS,25025000,58335,"AVENIDA NILO PEÇANHA, 2.279","AVENIDA NILO PEÇANHA, 2.279, BAR DOS CAVALEIROS, DUQUE DE CAXIAS, Rio de Janeiro",101,ESCOLA MUNICIPAL VISCONDE DE ITABORAÍ,DUQUE DE CAXIAS,1546,0.29,0.0,0.02,0.0,0.63,0.05,168,0,6,0,175,14,103
111,109,74,340,JARDIM LEAL,25035570,58335,RUA SOLANGE 7,"RUA SOLANGE 7, JARDIM LEAL, DUQUE DE CAXIAS, Rio de Janeiro",120,CIEP JARDIM LEAL,DUQUE DE CAXIAS,1031,0.22,0.0,0.03,0.0,0.65,0.11,40,0,9,0,220,37,194
160,89,85,375,CENTRO,25010090,58335,AV. DR. MANOEL TELLES 98,"AV. DR. MANOEL TELLES 98, CENTRO, DUQUE DE CAXIAS, Rio de Janeiro",126,COLEGIO CARLOS GOMES,DUQUE DE CAXIAS,1147,0.23,0.0,0.01,0.0,0.66,0.1,249,0,5,0,249,36,103
67,192,61,396,PARQUE PAULISTA,25261000,58335,"AV. 31 DE MARÇO, 88","AV. 31 DE MARÇO, 88, PARQUE PAULISTA, DUQUE DE CAXIAS, Rio de Janeiro",137,CIEP 015 - MUNICIPALIZADO HENRIQUE DE SOUZA FILHO - HENFIL,DUQUE DE CAXIAS,1279,0.15,0.0,0.04,0.0,0.65,0.15,131,0,17,0,259,59,127
154,86,120,387,PARQUE LAGUNA E DOURADOS,25085420,58335,"AV. DR. MANOEL TELLES, S/N","AV. DR. MANOEL TELLES, S/N, PARQUE LAGUNA E DOURADOS, DUQUE DE CAXIAS, Rio de Janeiro",147,CENTRO EDUCACIONAL COLEGIO CARLOS GOMES (QUADRA),DUQUE DE CAXIAS,1325,0.31,0.0,0.02,0.0,0.62,0.05,274,0,9,0,240,18,103
108,128,124,396,CENTENÁRIO,25025010,58335,"RUA DOUTOR MANOEL REIS, 501","RUA DOUTOR MANOEL REIS, 501, CENTENÁRIO, DUQUE DE CAXIAS, Rio de Janeiro",160,COLÉGIO PEDRO II,DUQUE DE CAXIAS,1040,0.31,0.0,0.02,0.0,0.6,0.07,9,0,9,0,236,27,77
60,175,93,369,SANTA CRUZ DA SERRA,25251740,58335,RODOVIA WASHINGTON LUIZ S/N,"RODOVIA WASHINGTON LUIZ S/N, SANTA CRUZ DA SERRA, DUQUE DE CAXIAS, Rio de Janeiro",134,CIEP MONTEIRO LOBATO,DUQUE DE CAXIAS,1147,0.25,0.0,0.02,0.0,0.64,0.09,74,0,8,0,235,33,128
87,143,116,384,CIDADE DOS MENINOS,25233000,58335,AV. PRESIDENTE KENNEDY KM 12,"AV. PRESIDENTE KENNEDY KM 12, CIDADE DOS MENINOS, DUQUE DE CAXIAS, Rio de Janeiro",154,ESCOLA ESTADUAL ASSIS CHATEAUBRIAND,DUQUE DE CAXIAS,1074,0.3,0.0,0.03,0.0,0.6,0.07,33,0,12,0,230,26,79
118,84,105,335,SÃO BENTO,25045010,58335,AV. PRES. KENNEDY 9422,"AV. PRES. KENNEDY 9422, SÃO BENTO, DUQUE DE CAXIAS, Rio de Janeiro",133,FEUDUC,DUQUE DE CAXIAS,1244,0.31,0.0,0.02,0.0,0.6,0.07,110,0,6,0,202,22,79
159,102,93,395,PERIQUITOS,25025320,58335,"RUA BERNARDO MONTEIRO, 13","RUA BERNARDO MONTEIRO, 13, PERIQUITOS, DUQUE DE CAXIAS, Rio de Janeiro",134,ESCOLA ESTADUAL INÁCIO BEZERRA DE MENEZES,DUQUE DE CAXIAS,1252,0.24,0.0,0.03,0.0,0.66,0.07,109,0,12,0,261,29,77
164,114,77,399,SÃO BENTO,25045010,58335,AV. PRESIDENTE KENNEDY 9422,"AV. PRESIDENTE KENNEDY 9422, SÃO BENTO, DUQUE DE CAXIAS, Rio de Janeiro",121,FEUDUC,DUQUE DE CAXIAS,1252,0.19,0.0,0.03,0.0,0.7,0.08,378,0,11,0,278,33,79
167,79,110,396,PARQUE LAFAIETE,25015100,58335,RUA EXP. AQUINO DE ARAUJO S/N ESQ. RUA RISOLETA CAETANO,"RUA EXP. AQUINO DE ARAUJO S/N ESQ. RUA RISOLETA CAETANO, PARQUE LAFAIETE, DUQUE DE CAXIAS, Rio de Janeiro",150,ESCOLA MUNICIPAL TODOS OS SANTOS,DUQUE DE CAXIAS,1503,0.28,0.0,0.02,0.0,0.62,0.08,212,0,8,0,246,32,103
57,180,87,390,VILA MARIA HELENA,25251600,58335,RUA EUSTAQUIO DE AZEVEDO S/N,"RUA EUSTAQUIO DE AZEVEDO S/N, VILA MARIA HELENA, DUQUE DE CAXIAS, Rio de Janeiro",153,CIEP 370 PROFESSOR SYLVIO GNECCO DE CARVALHO,DUQUE DE CAXIAS,1635,0.22,0.0,0.05,0.0,0.61,0.12,348,0,21,0,237,45,126
79,184,68,395,TAQUARA,25270000,58335,"PRAÇA SÃO PAULO, S/N","PRAÇA SÃO PAULO, S/N, TAQUARA, DUQUE DE CAXIAS, Rio de Janeiro",132,ESCOLA MUNICIPAL BARÃO DA TAQUARA,DUQUE DE CAXIAS,1333,0.17,0.0,0.03,0.0,0.67,0.13,168,0,12,0,263,52,127
51,164,111,350,XERÉM,25070000,58335,PRACA PREF. ROBERTO SILVEIRA S/N,"PRACA PREF. ROBERTO SILVEIRA S/N, XERÉM, DUQUE DE CAXIAS, Rio de Janeiro",135,ESCOLA ESTADUAL CIRCULO OPERARIO,DUQUE DE CAXIAS,1236,0.32,0.0,0.01,0.0,0.61,0.05,93,0,5,0,215,19,128
108,88,86,320,PARQUE SENHOR DO BONFIM,25000000,58335,AV. SALGADO FILHO 434,"AV. SALGADO FILHO 434, PARQUE SENHOR DO BONFIM, DUQUE DE CAXIAS, Rio de Janeiro",124,ESCOLA MUNICIPAL ZILLA JUNGER,DUQUE DE CAXIAS,1309,0.27,0.0,0.02,0.0,0.61,0.1,122,0,5,0,196,33,103
144,94,123,397,SÃO BENTO,25045000,58335,AV. PRESIDENTE KENNEDY S/N,"AV. PRESIDENTE KENNEDY S/N, SÃO BENTO, DUQUE DE CAXIAS, Rio de Janeiro",159,CIEP 118 VEREADOR VILSON CAMPOS MACEDO,DUQUE DE CAXIAS,1783,0.31,0.0,0.03,0.0,0.6,0.06,147,0,12,0,238,24,79
102,136,69,391,SARACURUNA,25212690,58335,"RUA 15 DE NOVEMBRO, S/N","RUA 15 DE NOVEMBRO, S/N, SARACURUNA, DUQUE DE CAXIAS, Rio de Janeiro",153,ESCOLA ESTADUAL PROFESSORA SARAH FARIA BRAZ,DUQUE DE CAXIAS,1767,0.18,0.0,0.06,0.0,0.61,0.15,350,0,24,0,238,60,126
135,106,93,385,PARQUE PAULICÉIA,25071000,58335,RUA PARANA 739,"RUA PARANA 739, PARQUE PAULICÉIA, DUQUE DE CAXIAS, Rio de Janeiro",144,ESCOLA MUNICIPAL MOTA SOBRINHO,DUQUE DE CAXIAS,1023,0.24,0.0,0.04,0.0,0.63,0.09,16,0,15,0,241,36,200
105,66,44,260,JARDIM LEAL,25035570,58335,RUA SOLANGE 7,"RUA SOLANGE 7, JARDIM LEAL, DUQUE DE CAXIAS, Rio de Janeiro",89,CIEP JARDIM LEAL,DUQUE DE CAXIAS,1031,0.17,0.0,0.03,0.0,0.66,0.14,90,0,8,0,171,37,194
173,71,83,361,PARQUE LAGUNA E DOURADOS,25011320,58335,RUA JOSE LUIZ RODRIGUES CALAZANS 355,"RUA JOSE LUIZ RODRIGUES CALAZANS 355, PARQUE LAGUNA E DOURADOS, DUQUE DE CAXIAS, Rio de Janeiro",117,ESCOLA MUNICIPAL LAGUNAS E DOURADOS (PROFº. ROMEU MENEZES DOS SANTOS,DUQUE DE CAXIAS,1457,0.23,0.0,0.01,0.0,0.68,0.08,261,0,5,0,244,29,103
64,237,52,382,XERÉM,25250080,58335,"RUA RIO GRANDE DO SUL, N 17","RUA RIO GRANDE DO SUL, N 17, XERÉM, DUQUE DE CAXIAS, Rio de Janeiro",81,ESCOLA MINICIPAL DOUTOR ELY COMBAT,DUQUE DE CAXIAS,1104,0.14,0.0,0.02,0.0,0.79,0.06,42,0,7,0,301,22,128
